scheme_code,isin_growth,isin_div_reinv,scheme_name,nav,date
150871,INF194KB1EN2,,BANDHAN CRISIL IBX 90:10 SDL PLUS GILT APRIL 2032 INDEX FUND - DIRECT GROWTH,12.7678,2026-03-30
150885,INF740KA1RO2,,DSP FMP Series - 268 - 1281 Days - Direct - Growth,12.6599,2026-03-30
150888,INF194KB1EZ6,,BANDHAN CRISIL IBX 90:10 SDL PLUS GILT - SEP27 INDEX FUND - DIRECT GROWTH,12.8179,2026-03-30
150892,INF754K01QT8,,Edelweiss Nifty Smallcap 250 Index Fund - Direct Plan - Growth,14.8593,2026-03-30
150899,INF754K01QL5,,Edelweiss Nifty Next 50 Index Fund - Direct Plan - Growth,14.0581,2026-03-30
150902,INF754K01QD2,,Edelweiss Nifty Midcap150 Momentum 50 Index Fund - Direct Plan - Growth,16.0462,2026-03-30
150906,INF204KC1881,,Nippon India Nifty G-Sec Sep 2027 Maturity Index Fund-Direct Plan-Growth Option,12.6768,2026-03-30
150915,INF174V01BK7,,Mahindra Manulife Small Cap Fund - Direct Plan - Growth,18.0688,2026-03-30
150916,INF200KA18S2,,SBI Fixed Maturity Plan (FMP)-Series 72 (1239 Days) Direct Plan- Income Distribution Cum Capital Withdrawal Payout,12.6016,2026-03-30
150919,INF200KA17S4,,SBI Fixed Maturity Plan (FMP)-Series 72 (1239 Days) Direct Plan- Growth,12.6017,2026-03-30
150920,INF204KC1AC0,,Nippon India Nifty G-Sec Jun 2036 Maturity Index Fund-Direct Plan-Growth Option,12.7375,2026-03-30
150930,INF109KC11M9,,ICICI Prudential Nifty Pharma Index Fund - Direct Plan - Growth,17.1958,2026-03-30
150932,INF204KC1931,,Nippon India Fixed Maturity Plan - XLIV - Series 4-Direct Plan-Growth Option,12.5465,2026-03-30
150938,INF209KB10P4,,Aditya Birla Sun Life Crisil IBX 60:40 SDL + AAA PSU APR 2026 Index Fund-Direct Growth,12.54,2026-03-30
150950,INF109KC17M6,,ICICI Prudential Fixed Maturity Plan - Series 88 - 1226 Days Plan F - Direct Plan - Growth,12.5622,2026-03-30
150963,INF789F1AWU9,,UTI Fixed Term Income Fund - Series XXXV-II (1223 Days) - Direct Plan - Growth Option,12.5509,2026-03-30
150984,INF200KA11T5,,SBI Fixed Maturity Plan (FMP) - Series 73 (1226 Days) - Direct Plan - Growth,12.5686,2026-03-30
150989,INF754K01RC2,,BHARAT Bond ETF FOF - April 2033 - Direct Plan - Growth,12.56,2026-03-30
150996,INF917K01HN3,,HSBC Corporate Bond Fund - Direct Growth,80.6945,2026-03-30
151014,INF917K01FI7,,HSBC Gilt Fund - Direct Growth,74.6124,2026-03-30
151036,INF917K01FZ1,,HSBC Midcap Fund - Direct Growth,414.5941,2026-03-30
151040,INF917K01FW8,,HSBC Infrastructure Fund - Direct Growth,47.8878,2026-03-30
151045,INF917K01UH8,,HSBC Credit Risk Fund - Direct Growth,36.4913,2026-03-30
151054,INF917K01FE6,,HSBC Money Market Fund - Direct Growth,28.948,2026-03-30
151060,INF917K01GE4,,HSBC Equity Savings Fund - Direct Growth,37.6232,2026-03-30
151067,INF917K01IQ4,,HSBC Short Duration Fund - Direct Growth,29.0595,2026-03-30
151078,INF917K01GP0,,HSBC ELSS Tax saver Fund - Direct Growth,131.4981,2026-03-30
151087,INF917K01HA0,,HSBC Dynamic Bond Fund - Direct Growth,32.4308,2026-03-30
151107,INF917K01HH5,,HSBC Banking and PSU Debt Fund - Direct Growth,26.4096,2026-03-30
151113,INF917K01HD4,,HSBC Value Fund - Direct Growth,114.3934,2026-03-30
151117,INF917K01GM7,,HSBC Low Duration Fund - Direct Growth,31.6364,2026-03-30
151122,INF917K01LE4,,HSBC Aggressive Hybrid Fund - Direct Growth,58.7144,2026-03-30
151129,INF917K01IN1,,HSBC Balanced Advantage Fund - Direct Growth,48.0448,2026-03-30
151130,INF917K01QA1,,HSBC Small Cap Fund - Direct Growth,76.0261,2026-03-30
151138,INF917K01QR5,,HSBC Arbitrage Fund - Direct Growth,21.3085,2026-03-30
151142,INF917K01RI2,,HSBC Business Cycles Fund - Direct Growth,39.6701,2026-03-30
151146,INF917K01TK4,,HSBC Medium Duration Fund - Direct Growth,23.1627,2026-03-30
151157,INF917K01D12,,HSBC NIFTY 50 INDEX FUND - Direct Growth,26.2732,2026-03-30
151160,INF917K01D79,,HSBC NIFTY NEXT 50 INDEX FUND - Direct Growth,26.4884,2026-03-30
151165,INF579M01AN2,,360 ONE ELSS Tax Saver Nifty 50 Index Fund - Direct Plan - Growth,12.6283,2026-03-30
151174,INF174KA1KX3,,Kotak FMP Series 300 - Direct Plan - Growth,12.546,2026-03-30
151179,INF846K014L3,,Axis Long Duration Fund - Direct Plan - Growth,1207.2285,2026-03-30
151181,INF179KC1EJ8,,HDFC Nifty G-Sec Jun 2027 Index Fund - Growth Option - Direct Plan,12.709,2026-03-30
151183,INF179KC1EL4,,HDFC Nifty G-Sec Sep 2032 Index Fund - Growth Option - Direct Plan,12.6987,2026-03-30
151185,INF789F1AWX3,,UTI CRISIL SDL Maturity April 2033 Index Fund - Direct Plan - Growth Option,12.6091,2026-03-30
151186,INF209KB18P7,,Aditya Birla Sun Life Fixed Term Plan - Series UB (1224 days) - Direct Plan Growth Option,12.5394,2026-03-30
151190,INF966L01AZ7,,quant Overnight Fund - Growth Option - Direct Plan,12.3096,2026-03-30
151211,INF109KC13P8,,ICICI Prudential Nifty SDL Sep 2026 Index Fund - Direct Plan - Growth,12.6023,2026-03-30
151214,INF200KA16T4,,SBI Long Duration Fund - Direct Plan - Growth,12.2351,2026-03-30
151218,INF174KA1LC5,,Kotak Nifty SDL Jul 2026 Index Fund Direct Plan Growth,12.5791,2026-03-30
151225,INF179KC1EN0,,HDFC FMP 1204D December - Growth Option - Direct Plan,12.5089,2026-03-30
151228,INF966L01BF7,,quant Gilt Fund - Growth Option - Direct Plan,12.1405,2026-03-30
151232,INF277KA1679,,Tata Multicap Fund - Direct Plan - Growth,13.6602,2026-03-30
151239,INF789F1AWZ8,,UTI CRISIL SDL Maturity June 2027 Index Fund - Direct Plan - Growth Option,12.6542,2026-03-30
151252,INF200KA11U3,,SBI Fixed Maturity Plan (FMP)-Series 74 (1243 Days)- Direct Plan- Growth,12.5574,2026-03-30
151253,INF200KA12U1,,SBI Fixed Maturity Plan (FMP)-Series 74 (1243 Days)- Direct Plan- Income Distribution Cum Capital Withdrawal Payout,12.5573,2026-03-30
151267,INF03VN01738,,WhiteOak Capital Balanced Advantage Fund Direct Plan Growth,13.984,2026-03-30
151273,INF277KA1737,,Tata Nifty G-Sec Dec 2029 Index Fund - Direct Plan - Growth,12.7233,2026-03-30
151283,INF251K01RL0,,Baroda BNP Paribas Nifty SDL December 2026 Index Fund - Direct Plan - Growth Option,12.5878,2026-03-30
151286,INF174KA1LP7,,Kotak FMP Series 304-Direct Plan-Growth Option,12.7489,2026-03-30
151290,INF336L01QN5,,HSBC Multi Cap Fund - Direct - Growth,17.4249,2026-03-30
151300,INF846K010N7,,Axis CRISIL IBX 50:50 Gilt Plus SDL June 2028 Index Fund - Direct Plan - Growth,12.6052,2026-03-30
151301,INF277KA1794,,Tata Nifty G Sec Dec 2026 Index Fund-Direct Plan-Growth,12.5401,2026-03-30
151307,INF209KB15R9,,Aditya Birla Sun Life Multi Asset Allocation Fund-Direct Growth,15.9593,2026-03-30
151313,INF179KC1ET7,,HDFC Long Duration Debt Fund - Growth Option - Direct Plan,11.9597,2026-03-30
151316,INF174KA1LT9,,Kotak FMP Series 305 - Direct Plan - Growth,12.4672,2026-03-30
151320,INF0GCD01560,,TRUSTMF CORPORATE BOND FUND-DIRECT PLAN-GROWTH,1238.9602,2026-03-30
151329,INF740KA1SB7,,DSP CRISIL-IBX 50:50 Gilt Plus SDL - April 2033 Index Fund - Direct - Growth,12.6348,2026-03-30
151341,INF789F1AXH4,,UTI Fixed Term Income Fund - Series XXXV-III (1176 Days) - Direct Plan - Growth Option,12.4517,2026-03-30
151350,INF200KA10V3,,SBI Fixed Maturity Plan (FMP) - Series 76 (1221 Days) - Direct Plan - Income Distribution Cum Capital Withdrawal Payout,12.4631,2026-03-30
151351,INF200KA19U6,,SBI Fixed Maturity Plan (FMP) - Series 76 (1221 Days) - Direct Plan - Growth,12.4631,2026-03-30
151364,INF789F1AXL6,,UTI NIFTY SDL Plus AAA PSU Bond Apr 2026 75:25 Index Fund - Direct Plan - Growth Option,12.4744,2026-03-30
151365,INF754K01RK5,,Edelweiss CRISIL IBX 50:50 Gilt Plus SDL Short Duration Index fund - Direct Plan - Growth,12.5243,2026-03-30
151368,INF846K016N4,,Axis Business Cycles Fund - Direct Plan - Growth,15.1,2026-03-30
151373,INF740KA1SH4,,DSP Nifty SDL Plus G-Sec Sep 2027 50:50 Index Fund - Direct - Growth,12.6545,2026-03-30
151379,INF00XX01CO7,,ITI Flexi Cap Fund- Direct Plan- Growth,16.8947,2026-03-30
151384,INF174KA1MD1,,Kotak Banking & Financial Services Fund - Direct Plan - Growth,14.669,2026-03-30
151390,INF204KC1AI7,,Nippon India Nifty SDL Plus G-Sec-Jun 2029 Maturity 70:30 Index Fund-Direct Plan-Growth Option,12.6457,2026-03-30
151407,INF663L01X21,,"PGIM India CRISIL IBX Gilt Index - Apr 2028 Fund - Direct Plan, Growth Option",12.5839,2026-03-30
151408,INF194KB1FF5,,BANDHAN CRISIL IBX GILT APRIL 2032 INDEX FUND - DIRECT GROWTH,12.6222,2026-03-30
151412,INF769K01JJ2,,Mirae Asset Flexi Cap Fund - Direct Plan - Growth,14.967,2026-03-30
151420,INF174KA1MJ8,,Kotak Nifty SDL Jul 2033 Index Fund Direct Plan Growth Option,12.5226,2026-03-30
151427,INF209KB14S0,,Aditya Birla Sun Life CRISIL IBX SDL Jun 2032 INDEX FUND - Direct Growth,12.6032,2026-03-30
151435,INF846K012O1,,AXIS CRISIL IBX 50:50 Gilt Plus SDL September 2027 Index Fund- DIRECT PLAN-GROWTH,12.6283,2026-03-30
151440,INF204KC1AO5,,Nippon India Nifty G-Sec Oct 2028 Maturity Index Fund-Direct Plan-Growth Option,12.6234,2026-03-30
151443,INF761K01FR0,,Bank of India Multi Cap Fund Direct Plan - Growth,17.26,2026-03-30
151449,INF740KA1SN2,,DSP FMP Series - 270 - 1144 Days - Direct - Growth,12.4434,2026-03-30
151451,INF200KA19V4,,SBI Fixed Maturity Plan (FMP)-Series 78 (1170 Days) Direct Plan- Growth,12.4534,2026-03-30
151452,INF200KA10W1,,SBI Fixed Maturity Plan (FMP)-Series 78 (1170 Days) Direct Plan- Income Distribution Cum Capital Withdrawal Payout,12.4536,2026-03-30
151456,INF179KC1FI7,,HDFC Nifty SDL Oct 2026 Index Fund - Growth Option - Direct Plan,12.551,2026-03-30
151458,INF179KC1FC0,,HDFC MNC Fund - Growth Option - Direct Plan,12.251,2026-03-30
151470,,,HDFC FMP 2638D February 2023 - Growth Option - Direct Plan,12.7611,2026-03-30
151471,INF959L01GR6,,NAVI ELSS TAX SAVER NIFTY 50 INDEX FUND - DIRECT PLAN GROWTH,13.4985,2026-03-30
151479,INF336L01QT2,,HSBC CRISIL IBX Gilt June 2027 Index Fund - Direct - Growth,12.4841,2026-03-30
151485,INF789F1AXP7,,UTI Fixed Term Income Fund Series XXXVI - I (1574 Days) - Direct Plan - Growth Option,12.7058,2026-03-30
151487,INF789F1AXR3,,UTI NIFTY SDL Plus AAA PSU Bond Apr 2028- 75:25 Index Fund - Direct Plan - Growth Option,12.609,2026-03-30
151489,INF179KC1FS6,,HDFC Nifty G-Sec Jun 2036 Index Fund - Growth Option - Direct Plan,12.6314,2026-03-30
151493,INF109KC14R2,,ICICI Prudential Fixed Maturity Plan - Series 88 - 1303 Days Plan S - Direct Plan - Growth,12.5197,2026-03-30
151495,INF179KC1FQ0,,HDFC Nifty G-Sec Apr 2029 Index Fund - Growth Option - Direct Plan,12.6663,2026-03-30
151501,INF846K018O8,,Axis Fixed Term Plan - Series 112 (1143 Days) - Direct Plan - Growth,12.4919,2026-03-30
151523,INF789F1AYB5,,UTI Long Duration Fund - Direct Plan - Growth Option,11.8179,2026-03-30
151548,INF194KB1FV2,,Bandhan US Treasury Bond 0-1 year specific Debt Passive FOF - DIRECT PLAN - GROWTH,13.1177,2026-03-30
151558,INF200KA10X9,,SBI Fixed Maturity Plan (FMP) - Series 79 (1130 Days) - Direct Plan - Income Distribution cum Capital Withdrawal Payout,12.4075,2026-03-30
151559,INF200KA19W2,,SBI Fixed Maturity Plan (FMP) - Series 79 (1130 Days) - Direct Plan - Growth,12.4072,2026-03-30
151562,INF209KB16T3,,Aditya Birla Sun Life Nifty SDL SEP 2027 Index Fund-Direct Growth,12.6369,2026-03-30
151565,,,HDFC FMP 1269D March 2023 - Growth Option - Direct Plan,12.3978,2026-03-30
151570,INF179KC1GA2,,HDFC NIFTY SDL Plus G-Sec Jun 2027 40:60 Index Fund - Growth Option - Direct Plan,12.4844,2026-03-30
151574,INF251K01RR7,,Baroda BNP Paribas NIFTY SDL December 2028 Index Fund - Direct Plan - Growth Option,12.6127,2026-03-30
151577,INF209KB11U2,,Aditya Birla Sun Life Crisil IBX Gilt Apr 2028 Index Fund-Direct Growth,12.3868,2026-03-30
151580,INF109KC12T2,,ICICI Prudential Innovation Fund - Direct Plan - Growth,17.09,2026-03-30
151586,INF846K011Q8,,Axis Fixed Term Plan - Series 113 (1228 Days) - Direct Plan - Growth,12.4306,2026-03-30
151593,INF205KA1775,,Invesco India Nifty G-sec Jul 2027 Index Fund - Direct Plan - Growth,1247.9158,2026-03-30
151597,INF205KA1817,,Invesco India Nifty G-sec Sep 2032 Index Fund - Direct Plan - Growth,1246.4368,2026-03-30
151603,INF174KA1MQ3,,Kotak Silver ETF Fund of Fund - Direct Plan - Growth Option,30.5182,2026-03-30
151611,INF0J8L01115,,NJ ELSS Tax Saver Scheme Direct Growth,13.11,2026-03-30
151620,INF0GCD01651,,TRUSTMF FIXED MATURITY PLAN -SERIES II (1196 DAYS)-DIRECT PLAN -GROWTH,1274.7828,2026-03-30
151622,INF582M01IW0,,Union Fixed Maturity Plan - Series 13 - Direct Plan - Growth Option,12.2856,2026-03-30
151639,INF200KA17X4,,SBI Fixed Maturity Plan (FMP)-Series 81 (1157 Days) Direct Plan- Growth,12.3663,2026-03-30
151640,INF200KA18X2,,SBI Fixed Maturity Plan (FMP)-Series 81 (1157 Days) Direct Plan- Income Distribution Cum Capital Withdrawal Payout,12.3664,2026-03-30
151649,INF174KA1NB3,,Kotak Nifty Smallcap 50 Index Fund - Direct Plan - Growth,17.417,2026-03-30
151674,INF204KC1BF1,,Nippon India Fixed Maturity Plan-XLV-Series 4-Direct Plan-Growth Option,12.3359,2026-03-30
151681,INF174KA1NG2,,Kotak FMP Series 308 - Direct Plan - Growth,12.6037,2026-03-30
151686,INF174KA1NO6,,Kotak FMP Series 310 - Direct Plan - Growth Option,12.3257,2026-03-30
151691,INF769K01JZ8,,Mirae Asset Nifty SDL June 2028 Index Fund - Direct Plan - Growth,12.5217,2026-03-30
151700,INF209KB13V6,,Aditya Birla Sun Life Fixed Term Plan - Series UJ (1110 days) - Direct Plan - Growth Option,12.3368,2026-03-30
151708,INF204KC1BJ3,,Nippon India Fixed Maturity Plan-XLV-Series 5-Direct Plan-Growth Option,12.8548,2026-03-30
151713,INF966L01BL5,,quant Dynamic Asset Allocation Fund - Growth Option - Direct Plan,15.1979,2026-03-30
151724,INF179KC1GC8,,HDFC NIFTY Midcap 150 Index Fund - Growth Option - Direct Plan,16.583,2026-03-30
151727,INF179KC1GE4,,HDFC NIFTY Smallcap 250 Index Fund - Growth Option - Direct Plan,15.5557,2026-03-30
151728,INF179KC1GG9,,HDFC BSE 500 Index Fund - Growth Option - Direct Plan,13.852,2026-03-30
151731,INF789F1AYL4,,UTI Silver ETF Fund of Fund - Direct Plan - Growth Option,29.1326,2026-03-30
151739,INF789F1AYN0,,UTI Nifty 500 Value 50 Index Fund - Direct Plan - Growth Option,20.7216,2026-03-30
151745,INF03VN01761,,WhiteOak Capital Multi Asset Allocation Fund Direct Plan Growth,15.449,2026-03-30
151750,INF179KC1GI5,,HDFC Defence Fund - Growth Option - Direct Plan,22.478,2026-03-30
151753,INF0K1H01081,,Samco Active Momentum Fund - Direct Plan - Growth Option,12.26,2026-03-30
151755,INF251K01SD5,,Baroda BNP Paribas Value Fund - Direct Plan - Growth option,12.9758,2026-03-30
151757,INF966L01BR2,,quant Business Cycle Fund - Growth Option - Direct Plan,14.0306,2026-03-30
151762,INF789F1AYP5,,UTI Nifty50 Equal Weight Index Fund - Direct Plan - Growth Option,13.6352,2026-03-30
151764,INF789F1AYR1,,UTI BSE Housing Index Fund - Direct Plan - Growth Option,11.9531,2026-03-30
151769,INF200KA16Y4,,SBI BSE Sensex Index Fund - Direct Plan - Growth,11.7987,2026-03-30
151777,INF00XX01CS8,,ITI Focused Fund - Direct Plan - Growth,14.6364,2026-03-30
151781,INF174KA1OB1,,Kotak Nifty 200 Momentum 30 Index Fund - Direct Plan - Growth Option,12.909,2026-03-30
151785,INF846K017R3,,Axis Nifty IT Index Fund - Direct Plan - Growth,10.1537,2026-03-30
151791,INF966L01BX0,,quant BFSI Fund - Growth Option - Direct Plan,17.5054,2026-03-30
151792,INF754K01RS8,,Edelweiss Multi Asset Allocation Fund - Direct Plan - Growth,12.2552,2026-03-30
151796,INF579M01AS1,,360 ONE FLEXICAP FUND-DIRECT PLAN- GROWTH,13.725,2026-03-30
151804,INF179KC1GO3,,HDFC Consumption Fund - Growth Option - Direct Plan,12.331,2026-03-30
151810,INF769K01KK8,,Mirae Asset Multicap Fund - Direct Plan - Growth,13.148,2026-03-30
151814,INF247L01BQ9,,Motilal Oswal Nifty Microcap 250 Index Fund- Direct- Growth Option,13.8061,2026-03-30
151816,INF194KB1GB2,,BANDHAN FINANCIAL SERVICES FUND - DIRECT PLAN - GROWTH,13.398,2026-03-30
151824,INF760K01KO9,,Canara Robeco Multi Cap Fund - Direct Plan - Growth Option,13.36,2026-03-30
151833,INF0QA701011,,Bajaj Finserv Liquid Fund - Direct Plan - Growth,1202.2295,2026-03-30
151849,INF0QA701177,,Bajaj Finserv Overnight Fund - Direct Plan - Growth,1181.5504,2026-03-30
151853,INF966L01CD0,,quant Healthcare Fund - Growth Option - Direct Plan,14.8149,2026-03-30
151881,INF174KA1OL0,,Kotak Quant Fund - Direct Plan - Growth Option,13.673,2026-03-30
151885,INF789F1AYV3,,UTI Balanced Advantage Fund - Direct Plan - Growth Option,12.1524,2026-03-30
151889,INF0QA701334,,Bajaj Finserv Money Market Fund-Direct Plan-Growth,1214.5689,2026-03-30
151895,INF0QA701342,,Bajaj Finserv Flexi Cap Fund-Direct Plan-Growth,13.66,2026-03-30
151901,INF179KC1GU0,,HDFC Transportation and Logistics Fund - Growth Option - Direct Plan,15.885,2026-03-30
151905,INF582M01JE6,,Union Innovation & Opportunities Fund - Direct Plan - Growth Option,12.73,2026-03-30
151911,INF174KA1OR7,,Kotak Nifty Financial Services Ex-Bank Index Fund - Direct Plan - Growth option,14.05,2026-03-30
151916,INF966L01CJ7,,quant Manufacturing Fund - Growth Option - Direct Plan,12.7646,2026-03-30
151917,INF0J8L01156,,NJ Flexi Cap Fund - Direct Plan - Growth Option,12.03,2026-03-30
151937,INF397L01AW2,,LIC MF Nifty Next 50 Index Fund-Direct Plan-Growth,49.324,2026-03-30
151952,INF397L01AZ5,,LIC MF Equity Savings Fund-Direct Plan-Growth,30.3126,2026-03-30
151974,INF397L01BU4,,LIC MF Gold ETF Fund of Fund-Direct Plan-Growth,39.5468,2026-03-30
152002,INF397L01JK8,,LIC MF Mid Cap Fund-Direct Plan-Growth,28.2676,2026-03-30
152004,INF397L01JS1,,LIC MF Small Cap Fund-Direct Plan-Growth,29.3001,2026-03-30
152010,INF397L01KA7,,LIC MF Focused Fund-Direct Plan-Growth,20.409,2026-03-30
152018,INF397L01KU5,,LIC MF Value Fund-Direct Plan-Growth,24.4751,2026-03-30
152024,INF397L01LK4,,LIC MF Healthcare Fund-Direct Plan-Growth,30.1128,2026-03-30
152032,INF336L01QZ9,,HSBC Consumption Fund - Direct Growth,12.8924,2026-03-30
152033,INF204KC1BO3,,Nippon India Innovation Fund-Direct Plan-Growth Option,12.6415,2026-03-30
152039,INF174KA1OX5,,Kotak BSE Housing Index Fund - Direct Plan - Growth Option,11.131,2026-03-30
152041,INF194KB1GK3,,Bandhan Nifty IT Index Fund - Direct Plan - Growth,9.8425,2026-03-30
152045,INF174V01BQ4,,Mahindra Manulife Business Cycle Fund - Direct Plan - Growth,14.5067,2026-03-30
152051,INF680P01406,,Shriram Multi Asset Allocation Fund - Direct Growth,12.8477,2026-03-30
152056,INF740KA1TE9,,DSP Multi Asset Allocation Fund - Direct - Growth,15.6595,2026-03-30
152059,INF179KC1HI3,,HDFC Technology Fund - Growth Option - Direct Plan,10.898,2026-03-30
152062,INF959L01HK9,,NAVI BSE SENSEX INDEX FUND - DIRECT PLAN - GROWTH,11.1605,2026-03-30
152064,INF174KA1PD4,,Kotak Multi Asset Allocation Fund - Direct Plan - Growth Option,15.11,2026-03-30
152067,INF966L01CT6,,quant Teck Fund - Growth Option - Direct Plan,8.3241,2026-03-30
152071,INF03VN01803,,WhiteOak Capital Multi Cap Fund Direct Plan Growth,14.001,2026-03-30
152076,INF579M01AY9,,360 ONE Balanced Hybrid Fund- Direct Plan - Growth,12.4413,2026-03-30
152077,INF0QA701524,,Bajaj Finserv Arbitrage Fund-Direct Plan-Growth,11.921,2026-03-30
152082,INF179KC1HO1,,HDFC Pharma and Healthcare Fund - Growth Option - Direct Plan,17.495,2026-03-30
152087,INF789F1AZA4,,UTI Innovation Fund - Direct Plan - Growth Option,9.2162,2026-03-30
152090,INF247L01BT3,,Motilal Oswal Developed Market Ex US ETFs Fund of Funds Direct Plan Growth,16.24,2026-03-30
152092,INF666M01HM4,,Groww Nifty Total Market Index Fund - Direct Plan - Growth,12.2456,2026-03-30
152094,INF754K01SD8,,Edelweiss Multi Cap Fund - Direct Plan - Growth,14.0103,2026-03-30
152098,INF174KA1PJ1,,Kotak Nifty G-Sec July 2033 Index Fund - Direct Plan - Growth,12.0511,2026-03-30
152102,INF194KB1GU2,,Bandhan Retirement Fund - Direct Plan - Growth,12.157,2026-03-30
152107,INF082J01432,,QUANTUM SMALL CAP FUND - DIRECT PLAN GROWTH OPTION,11.3,2026-03-30
152109,INF879O01225,,Parag Parikh Arbitrage Fund - Direct Plan Growth,11.8091,2026-03-30
152128,INF251K01SR5,,Baroda BNP Paribas Small Cap Fund - Direct Plan - Growth option,11.9699,2026-03-30
152132,INF03VN01829,,WhiteOak Capital Balanced Hybrid Fund Direct Plan Growth,12.64,2026-03-30
152135,INF0R8701046,,Helios Flexi Cap Fund - Direct Plan - Growth Option,13.33,2026-03-30
152140,INF209KB16W7,,Aditya Birla Sun Life US Treasury 1-3 Year Bond ETFs Fund Of Funds-Direct Growth,12.6548,2026-03-30
152150,INF209KB12X4,,Aditya Birla Sun Life US Treasury 3-10 Year Bond ETFs Fund Of Funds-Direct Growth,12.9541,2026-03-30
152152,INF0R8701079,,Helios Overnight Fund - Direct Plan - Growth Option,1155.0659,2026-03-30
152156,INF0R8F01018,,Zerodha Nifty LargeMidcap 250 Index Fund - Direct Plan - Growth option,12.5284,2026-03-30
152157,INF0R8F01026,,Zerodha ELSS Tax Saver Nifty LargeMidcap 250 Index Fund - Direct Plan - Growth option,12.5482,2026-03-30
152158,INF209KB15X7,,Aditya Birla Sun Life Transportation and Logistics Fund-Direct Growth,13.44,2026-03-30
152162,INF0QA701607,,Bajaj Finserv Banking and PSU Fund-Direct Plan- Growth,11.8683,2026-03-30
152169,INF174KA1PP8,,Kotak Consumption Fund - Direct plan - Growth Option,12.606,2026-03-30
152177,INF194KB1HA2,,Bandhan Nifty Alpha 50 Index Fund - Direct Plan - Growth,11.7084,2026-03-30
152183,INF740KA1TK6,,DSP Gold ETF Fund of Fund - Direct - Growth,23.2992,2026-03-30
152188,INF0K1H01131,,Samco Dynamic Asset Allocation Fund - Direct Plan - Growth Option,10.0,2026-03-30
152189,INF966L01CZ3,,quant Momentum Fund - Growth Option - Direct Plan,12.971,2026-03-30
152194,INF0QA701656,,Bajaj Finserv Balanced Advantage Fund-Direct Plan-Growth,10.932,2026-03-30
152202,INF846K016S3,,Axis India Manufacturing Fund - Direct Plan - Growth,13.56,2026-03-30
152206,INF740KA1TQ3,,DSP Banking & Financial Services Fund - Direct - Growth,12.96,2026-03-30
152214,INF174KA1PZ7,,Kotak Healthcare Fund - Direct Plan - Growth Option,13.655,2026-03-30
152219,INF582M01JK3,,Union Children's Fund - Direct Plan - Growth Option,11.4,2026-03-30
152226,INF03VN01845,,Whiteoak Capital Large & Mid Cap Fund Direct Plan Growth,12.37,2026-03-30
152237,INF247L01BY3,,Motilal Oswal Small Cap Fund - Direct - Growth,12.5564,2026-03-30
152240,INF846K017T9,,Axis US Specific Treasury Dynamic Debt Passive FOF - Direct Plan - Growth Option,12.216,2026-03-30
152243,INF740KA1TW1,,DSP Nifty Smallcap250 Quality 50 Index Fund - Direct - Growth,9.5681,2026-03-30
152254,INF666M01HS1,,Groww Banking & Financial Services Fund - Direct Plan - Growth,10.9659,2026-03-30
152255,INF966L01DF3,,quant Commodities Fund - Growth Option - Direct Plan,12.0425,2026-03-30
152264,INF194KB1HG9,,BANDHAN Nifty Smallcap 250 Index Fund - Direct Plan - Growth,10.3534,2026-03-30
152267,INF209KB19Y7,,Aditya Birla Sun Life Crisil IBX Gilt Apr 2033 Index Fund-Direct Growth,11.8185,2026-03-30
152287,INF277KA1869,,Tata Gold ETF Fund of Fund Direct Plan Growth Option,22.3791,2026-03-30
152293,INF277KA1943,,Tata Silver ETF Fund of Fund Direct Plan Growth Option,29.67,2026-03-30
152310,INF740KA1UC1,,DSP Multicap Fund - Direct - Growth,10.712,2026-03-30
152314,INF903JA1LK9,,Sundaram Multi Asset Allocation Fund Direct Plan Growth,12.6937,2026-03-30
152321,INF03VN01860,,WhiteOak Capital Banking & Financial Services Fund - Direct Growth,11.537,2026-03-30
152324,INF194KB1HM7,,Bandhan Multi Asset Allocation Fund - Direct Plan - Growth,13.3098,2026-03-30
152329,INF251K01SY1,,Baroda BNP Paribas Nifty 50 Index Fund - Direct Plan - Growth option,10.4794,2026-03-30
152336,INF966L01DN7,,quant Consumption Fund - Growth Option - Direct Plan,8.4653,2026-03-30
152344,INF769K01KZ6,,Mirae Asset Multi Asset Allocation Fund - Direct Plan - Growth,12.991,2026-03-30
152349,INF03VN01886,,WhiteOak Capital Pharma and Heathcare Fund Direct Plan Growth,13.9,2026-03-30
152354,INF247L01CE3,,Motilal Oswal Large Cap Direct Plan Growth,12.4503,2026-03-30
152358,INF0S5R01042,,Old Bridge Focused Fund - Direct Growth,11.36,2026-03-30
152365,INF109KC16T3,,ICICI Prudential Nifty50 Value 20 Index Fund - Direct Plan - Growth,9.857,2026-03-30
152370,INF200KB1027,,SBI Nifty50 Equal Weight Index Fund - Direct Plan - Growth,11.0008,2026-03-30
152371,INF200KB1035,INF200KB1043,SBI Nifty50 Equal Weight Index Fund - Direct Plan - Income Distribution Cum Capital Withdrawal Option,11.0001,2026-03-30
152380,INF336L01RI3,,HSBC Multi Asset Allocation Fund - Direct - Growth,12.8435,2026-03-30
152382,INF663L01Y12,,PGIM India Large and Midcap Fund - Direct Plan - Growth Option,11.3,2026-03-30
152389,INF204KC1BY2,,Nippon India Nifty Bank Index Fund - Direct Plan - Growth Option,10.8118,2026-03-30
152392,INF204KC1CE2,,Nippon India Nifty IT Index Fund - Direct Plan - Growth Option,7.9255,2026-03-30
152396,INF761K01FZ3,,Bank of India Multi Asset Allocation Fund-Direct Plan-Growth,11.9963,2026-03-30
152408,INF0QA701763,,Bajaj Finserv Large and Mid Cap Fund- Direct Plan- Growth,11.198,2026-03-30
152409,INF582M01JQ0,,Union Business Cycle Fund - Direct Plan - Growth Option,10.31,2026-03-30
152415,INF966L01DT4,,quant PSU Fund - Growth Option - Direct Plan,9.1104,2026-03-30
152417,INF200KB1126,,SBI Energy Opportunities Fund - Direct Plan - Growth,10.0138,2026-03-30
152420,INF200KB1134,INF200KB1142,SBI Energy Opportunities Fund - Direct Plan - Income Distribution Cum Capital Withdrawal Option,10.0136,2026-03-30
152422,INF846K012V6,,Axis BSE Sensex Index Fund - Direct Plan - Growth,10.0608,2026-03-30
152430,INF179KC1IC4,,HDFC NIFTY200 Momentum 30 Index Fund - Direct Plan,9.0639,2026-03-30
152431,INF666M01HY9,,Groww Nifty Smallcap 250 Index Fund - Direct Plan - Growth,9.5278,2026-03-30
152437,INF754K01SK3,,Edelweiss Technology Fund - Direct Plan - Growth,10.62,2026-03-30
152443,INF174V01BW2,,Mahindra Manulife Multi Asset Allocation Fund- Direct Plan - Growth,13.1449,2026-03-30
152449,INF760K01KY8,INF760K01KX0,Canara Robeco Manufacturing Fund - Direct Plan - IDWC Option,11.66,2026-03-30
152450,INF760K01KZ5,,Canara Robeco Manufacturing Fund - Direct Plan - Growth Option,11.66,2026-03-30
152459,INF769K01LG4,,Mirae Asset Nifty Smallcap 250 Momentum Quality 100 ETF Fund of Fund - Direct Plan - Growth,8.362,2026-03-30
152462,INF174KA1QZ5,,Kotak Technology Fund - Direct Plan - Growth Option,9.711,2026-03-30
152468,INF879O01266,,Parag Parikh Dynamic Asset Allocation Fund - Direct Plan Growth,11.4518,2026-03-30
152470,INF251K01TE1,,Baroda BNP Paribas Innovation Fund Direct plan - Growth Option,11.7271,2026-03-30
