scheme_code,isin_growth,isin_div_reinv,scheme_name,nav,date
149078,INF0GCD01396,INF0GCD01404,TRUSTMF Short Duration Fund-Direct Plan-Monthly Income Distribution Cum Capital Withdrawal,1144.0481,2026-03-30
149079,INF0GCD01412,INF0GCD01420,TRUSTMF Short Duration Fund-Direct Plan-Quarterly Income Distribution Cum Capital Withdrawal,1157.2619,2026-03-30
149085,INF760K01JW4,,Canara Robeco Value Fund - Direct Plan - Growth Option,17.27,2026-03-30
149091,INF789F1AVA3,,UTI Focused Fund - Direct Plan - Growth Option,14.5796,2026-03-30
149094,INF204KC1121,,Nippon India Flexi Cap Fund - Direct Plan - Growth Plan - Growth Option,15.4279,2026-03-30
149098,INF194KB1CF2,,Bandhan US specific Equity Active FOF - GROWTH - DIRECT PLAN,17.729,2026-03-30
149104,INF174V01AS2,,Mahindra Manulife Flexi Cap Fund - Direct Plan -Growth,15.5226,2026-03-30
149107,INF179KC1BM8,,HDFC NIFTY50 Equal weight Index Fund - Direct Plan - Growth Option,16.7046,2026-03-30
149112,INF769K01HN8,,Mirae Asset Money Market Fund Direct Growth,1336.1203,2026-03-30
149117,INF582M01HG5,,Union Money Market Fund - Direct Plan -  Growth Option,1324.9193,2026-03-30
149129,INF204KC1170,,Nippon India Fixed Maturity Plan - XLIII - Series 1- Direct Plan - Growth Option,13.2263,2026-03-30
149130,INF204KC1188,,Nippon India Fixed Maturity Plan - XLIII - Series 1 - Direct Plan - Income Distribution Cum Capital Withdrawal Plan,13.2263,2026-03-30
149134,INF200KA1Y73,,SBI Balanced Advantage Fund - Direct Plan - Growth,15.6651,2026-03-30
149139,INF174KA1HM2,,Kotak FMP Series 292 - Direct Plan - Growth,13.2242,2026-03-30
149141,INF955L01KK1,,Baroda BNP Paribas Business Cycle Fund - Direct Plan - Growth,15.0612,2026-03-30
149147,INF200KA1Z23,,SBI Fixed Maturity Plan (FMP) - Series 49 (1823 Days) - Direct Plan - Growth,13.2213,2026-03-30
149158,INF109KC1R89,,ICICI Prudential Nifty Alpha Low - Volatility 30 ETF FOF - Direct Plan - Growth,13.4724,2026-03-30
149166,INF846K010C0,,Axis Value Fund - Direct Plan - Growth,18.28,2026-03-30
149170,INF769K01HR9,,Mirae Asset S&P 500 Top 50 ETF Fund of Fund Direct Growth,24.241,2026-03-30
149174,INF200KA1Z64,,SBI Fixed Maturity Plan (FMP) - Series 50 (1843 Days) - Direct Plan - Growth,13.0857,2026-03-30
149180,INF179KC1BO4,,HDFC Developed World Overseas Equity Passive FOF - Direct Plan - Growth Option,18.428,2026-03-30
149185,INF174KA1HV3,,Kotak Multicap Fund-Direct Plan-Growth,18.635,2026-03-30
149190,INF740KA1QH8,,DSP FMP Series - 264 - 60M - 17D - Direct - Growth,13.1055,2026-03-30
149195,INF200KA10A7,,SBI Fixed Maturity Plan (FMP) - Series 51 (1846 Days) - Direct Plan - Growth,13.0753,2026-03-30
149199,INF209KB18B7,,Aditya Birla Sun Life Nifty SDL Plus PSU Bond SEP 2026 60:40 Index Fund-Direct Growth,12.9677,2026-03-30
149210,INF109KC1S88,,ICICI Prudential Nifty PSU Bond Plus SDL Sep 2027 40:60 Index Fund - Direct Plan Growth,13.0131,2026-03-30
149219,INF109KC1U50,,ICICI Prudential NASDAQ 100 Index Fund - Direct Plan - Growth,18.9171,2026-03-30
149230,INF174V01AY0,,Mahindra Manulife Asia Pacific REITs FOF - Direct Plan - Growth,10.6461,2026-03-30
149232,INF200KA14A9,,SBI Fixed Maturity Plan (FMP) - Series 52 (1848 Days) - Direct Plan - Growth,13.0562,2026-03-30
149240,INF247L01AQ1,,Motilal Oswal 5 Year G-Sec Fund Of Fund Direct -Growth,12.8715,2026-03-30
149243,INF846K017C5,,Axis Nifty AAA Bond Plus SDL Apr 2026 50:50 ETF FOF - Direct Plan - Growth Option,12.7055,2026-03-30
149247,INF754K01MT7,,Edelweiss NIFTY PSU Bond Plus SDL Apr 2027 50:50 Index Fund - Direct Plan Growth,13.0295,2026-03-30
149250,INF754K01NB3,,Edelweiss Nifty 50 Index Fund Direct Plan Growth,13.1503,2026-03-30
149254,INF754K01NJ6,,Edelweiss Nifty 100 Quality 30 Index Fund Direct Plan Growth,13.1418,2026-03-30
149261,INF767K01QY0,,LIC MF Balanced Advantage Fund-Direct Plan-Growth,13.4834,2026-03-30
149264,INF0J8L01040,,NJ Balanced Advantage Fund - Direct Plan - Growth Option,13.33,2026-03-30
149268,INF00XX01BO9,,ITI Pharma and Healthcare Fund - Direct Plan - Growth Option,16.0906,2026-03-30
149279,INF200KA18A0,,SBI Fixed Maturity Plan (FMP) - Series 53 (1839 Days) - Direct Plan - Growth,13.0719,2026-03-30
149283,INF109KC1V18,,ICICI Prudential Nifty Smallcap 250 Index Fund - Direct Plan - Growth,14.6612,2026-03-30
149288,INF179KC1BQ9,,HDFC NIFTY Next 50 Index Fund - Direct Plan - Growth Option,14.248,2026-03-30
149291,INF209KB18C5,,Aditya Birla Sun Life US Equity Passive FOF-Direct-Growth,18.0482,2026-03-30
149295,INF209KB14D2,,Aditya Birla Sun Life Business Cycle Fund-Direct Growth,14.39,2026-03-30
149298,INF663L01W63,,PGIM India Global Select Real Estate Securities Fund of Fund - Direct Plan - Growth Option,12.65,2026-03-30
149303,INF194KB1CL0,,BANDHAN MULTI CAP FUND - GROWTH - DIRECT PLAN,16.079,2026-03-30
149307,INF200KA12B1,,SBI Fixed Maturity Plan (FMP) - Series 54 (1842 Days) - Direct Plan - Growth,13.0577,2026-03-30
149318,INF579M01AI2,,360 ONE QUANT FUND DIRECT GROWTH,17.9635,2026-03-30
149319,INF579M01AJ0,INF579M01AK8,360 ONE QUANT FUND DIRECT INCOME DISTRIBUTION CUM CAPITAL WITHDRAWAL,17.9635,2026-03-30
149321,INF00XX01BU6,,ITI Banking and Financial Services Fund - Direct Plan - Growth Option,15.0647,2026-03-30
149329,INF204KC1303,,Nippon India Taiwan Equity Fund- Direct Plan- Growth Option,27.3614,2026-03-30
149331,INF109KC1V91,,ICICI Prudential BSE 500 ETF FOF - Direct Plan - Growth,14.0698,2026-03-30
149335,INF966L01AN3,,Quant Value Fund - Growth Option  - Direct Plan,19.0914,2026-03-30
149339,INF754K01NS7,INF754K01NT5,Edelweiss NIFTY Large Midcap 250 Index Fund - Direct Plan Payout,15.1782,2026-03-30
149343,INF754K01NR9,,Edelweiss NIFTY Large Midcap 250 Index Fund - Direct Plan Growth,15.1781,2026-03-30
149345,INF200KA16B2,,SBI Fixed Maturity Plan (FMP) - Series 55 (1849 Days) - Direct Plan - Growth,13.0272,2026-03-30
149361,INF277KA1224,,Tata Corporate Bond Fund-Direct Plan-Growth,13.0271,2026-03-30
149368,INF179KC1BS5,,HDFC Multi Cap Fund - Growth Option - Direct Plan,17.396,2026-03-30
149373,INF846K013D2,,Axis Nifty 50 Index Fund - Direct Plan - Growth,13.4937,2026-03-30
149381,INF769K01HU3,,Mirae AssetHang Seng TECH ETF Fund of Fund Direct Plan - Growth Option,11.441,2026-03-30
149383,INF846K013E0,,Axis Multicap Fund - Direct Growth,16.86,2026-03-30
149389,INF109KC1W58,,ICICI Prudential Nifty Midcap 150 Index Fund - Direct Plan - Growth,17.3608,2026-03-30
149401,INF754K01NY5,,BHARAT Bond ETF FOF - April 2032 Direct Growth,12.913,2026-03-30
149406,INF174V01BE0,,Mahindra Manulife Balanced Advantage Fund - Direct Plan - Growth,14.4275,2026-03-30
149409,INF109KC17H6,,ICICI Prudential Overnight fund - Direct Plan - Unclaimed Redemption Stable Scheme,1000.0,2026-03-30
149410,INF109KC15H0,,ICICI Prudential Overnight fund - Direct Plan - Unclaimed Redemption Transitory Scheme,1280.3689,2026-03-30
149431,INF200KA14C5,,SBI Fixed Maturity Plan (FMP) - Series 57 (1835 Days) - Direct Plan - Growth,12.9442,2026-03-30
149441,INF109KC1Y15,,ICICI Prudential Passive Multi-Asset Fund of Funds - Direct Plan - Growth,15.7694,2026-03-30
149447,INF959L01FR8,,Navi Nifty Next 50 Index Fund- Direct Plan- Growth,14.3514,2026-03-30
149450,INF0K1H01024,,Samco Flexi Cap Fund - Direct Plan - Growth Option,9.35,2026-03-30
149455,INF109KC1Z55,,ICICI Prudential Strategic Metal and Energy Equity Fund of Fund - Direct Plan Growth,31.5825,2026-03-30
149460,INF200KA18C6,,SBI Fixed Maturity Plan (FMP) - Series 58 (1842 Days) - Direct Plan - Growth,13.0551,2026-03-30
149466,INF846K019E7,,Axis Nifty Next 50 Index Fund - Direct Plan - Growth,14.9511,2026-03-30
149474,INF200KA13D5,,SBI CPSE Bond Plus SDL Sep 2026 50:50 Index Fund - Direct Plan - Growth,12.8699,2026-03-30
149482,INF173K01EW1,INF173K01EX9,Sundaram Nifty 100 Equal Weight Fund (Formerly Known as Principal Nifty 100 Equal Weight Fund)- Direct Plan - Income Distribution CUM Capital Withdrawal Option,73.5551,2026-03-30
149483,INF173K01EZ4,,Sundaram Nifty 100 Equal Weight Fund (Formerly Known as Principal Nifty 100 Equal Weight Fund) - Direct Plan - Growth Option,167.438,2026-03-30
149526,INF173K01FS6,,Sundaram Low Duration Fund (Formerly Known as Principal Low Duration Fund) - Direct Plan - Growth Option,3870.1863,2026-03-30
149533,INF173K01EK6,,Sundaram Focused Fund (Formerly Known as Principal Focused Multicap Fund)- Direct Plan - Growth Option,158.5567,2026-03-30
149539,INF173K01HI3,,Sundaram Ultra Short Duration Fund (Formerly Known as Principal Ultra Short Term Fund)- Direct Plan -Growth Option,3061.9786,2026-03-30
149549,INF173K01NC4,INF173K01NE0,Sundaram Arbitrage Fund( Formerly Known as Principal Arbitrage Fund) - Direct Plan- Monthly Income Distribution CUM Capital Withdrawal,13.8249,2026-03-30
149550,INF173K01NF7,,Sundaram Arbitrage Fund (Formerly Known as Prinicpal Arbitrage Fund) - Direct Plan - Growth,15.9888,2026-03-30
149570,INF173K01HZ7,,Sundaram ELSS Tax Saver Fund Direct Plan Growth,483.3303,2026-03-30
149587,INF173K01GP0,,Sundaram Short Duration Fund (Formerly Known as Principal Short Term Debt Fund)- Direct Plan - Growth Option,49.7551,2026-03-30
149601,INF173K01FE6,,Sundaram Aggressive Hybrid Fund (Formerly Known as Principal Hybrid Equity Fund)- Direct Plan - Growth Option,169.8877,2026-03-30
149602,INF173K01FB2,INF173K01FC0,Sundaram Aggressive Hybrid Fund(Formerly Known as Principal Hybrid Equity Fund)-Direct Plan - Monthly Income Distribution CUM Capital Withdrawal Option,36.8857,2026-03-30
149664,INF173K01GU0,,Sundaram Liquid Fund (Formerly Known as Principal Cash Management Fund) - Direct Plan - Growth Option,2433.6441,2026-03-30
149669,INF173K01FQ0,,Sundaram Multi Cap Fund (Formerly Known as Principal Multi Cap Growth Fund)-Direct Plan - Growth Option,374.5061,2026-03-30
149679,INF173K01GZ9,,Sundaram Equity Savings Fund (Formerly Known as Principal Equity Savings Fund) - Direct Plan - Growth Option,79.3629,2026-03-30
149717,INF173K01FI7,,Sundaram Balanced Advantage Fund ( Formerly Known as Principal Balanced Advantage Fund) - Direct Plan - Growth Option,38.6593,2026-03-30
149718,INF173K01FF3,INF173K01FG1,Sundaram Balanced Advantage Fund (Formerly Known as Principal Balanced Advantage Fund) - Direct Plan - Monthly Income Distribution CUM Capital Withdrawal Option,16.8461,2026-03-30
149760,INF204KC1378,,Nippon India Silver ETF FOF- Direct Plan-Growth Option,34.4664,2026-03-30
149763,INF205KA1494,,Invesco India Flexi Cap Fund - Direct Plan - Growth,16.77,2026-03-30
149775,INF109KC1Y98,,ICICI Prudential Silver ETF FOF - Direct Plan - Growth,34.5807,2026-03-30
149780,INF209KB16F2,,Aditya Birla Sun Life Silver ETF FOF-Direct Growth,35.0431,2026-03-30
149790,INF769K01HZ2,,Mirae Asset Nifty India Manufacturing ETF FOF - Direct Plan - Growth,17.859,2026-03-30
149794,INF209KB11F3,,Aditya Birla Sun Life Nifty SDL Apr 2027 Index Fund-Direct Growth,13.001,2026-03-30
149797,INF0GCD01453,,TRUST MF OVERNIGHT FUND-DIRECT PLAN-GROWTH,1273.5283,2026-03-30
149800,INF247L01AV1,,Motilal Oswal Nifty 200 Momentum 30 Index Fund-Direct Plan,13.4958,2026-03-30
149803,INF789F1AVD7,,UTI BSE Sensex Index Fund - Direct Plan - Growth Option,12.9267,2026-03-30
149804,INF959L01FT4,,Navi Nifty Bank Index Fund- Direct Plan- Growth,13.1981,2026-03-30
149822,INF200KA19D2,,SBI Fixed Maturity Plan (FMP) - Series 59 (1618 Days) - Direct Plan - Growth,12.8357,2026-03-30
149826,INF192K01MK9,,JM Overnight Fund - (Direct) - Unclaimed Redemption I.E.F. - Growth Plan,1073.9936,2026-03-30
149829,INF192K01MI3,,JM Overnight Fund - (Direct) - Unclaimed Redemption - Growth Plan,1364.997,2026-03-30
149830,INF959L01FV0,,Navi Total Stock Market US Specific Equity Passive FoF- Direct Plan- Growth,18.8053,2026-03-30
149832,INF194KB1CR7,,BANDHAN NIFTY 100 INDEX FUND - DIRECT PLAN - GROWTH,13.6595,2026-03-30
149838,INF209KB10G3,,Aditya Birla Sun Life Nifty Next 50 Index Fund-Direct Growth,14.9839,2026-03-30
149841,INF174KA1IF4,,Kotak Manufacture in India Fund - Direct Plan Growth,19.433,2026-03-30
149847,INF846K011G9,,Axis Multi Factor Passive FoF - Direct Plan - Growth Option,14.2268,2026-03-30
149855,INF174KA1IL2,,Kotak Nifty SDL Apr  2027 Top 12 Equal Weight Index Fund-Direct Plan-Growth,12.9148,2026-03-30
149858,INF109KC11A4,,ICICI Prudential Nifty Bank Index Fund - Direct Plan Growth,14.4472,2026-03-30
149865,INF174KA1IR9,,Kotak Nifty SDL Apr 2032 Top 12 Equal Weight Index Fund-Direct Plan- Growth,13.0382,2026-03-30
149868,INF179KC1BY3,,HDFC NIFTY 100 Index Fund - Direct Plan - Growth Option,13.5889,2026-03-30
149870,INF179KC1CA1,,HDFC Nifty 100 Equal Weight Index Fund - Direct Plan - Growth Option,15.0959,2026-03-30
149873,INF846K017G6,,Axis CRISIL IBX SDL May 2027 Index Fund - Direct Plan - Growth,12.889,2026-03-30
149878,INF200KA13E3,,SBI Fixed Maturity Plan (FMP) - Series 60 (1878 Days) - Direct Plan - Growth,12.9624,2026-03-30
149881,INF789F1AVF2,,UTI BSE Low Volatility Index Fund - Direct Plan  - Growth Option,15.1831,2026-03-30
149882,INF200KA18E2,,SBI Multicap Fund- Direct Plan- Growth option,15.4419,2026-03-30
149892,INF959L01FX6,,Navi Nifty Midcap 150 Index Fund Direct Plan- Growth,18.3827,2026-03-30
149894,INF846K013H3,,Axis Nifty Smallcap 50 Index Fund - Direct Plan - Growth Option,15.8627,2026-03-30
149910,INF959L01FZ1,,Navi NASDAQ100 US Specific Equity Passive FOF- Direct- Growth,19.4145,2026-03-30
149917,INF204KC1477,,Nippon India Fixed Maturity Plan-XLIII-Series 5- Direct Plan-Growth Option,13.1972,2026-03-30
149919,INF247L01AY5,,Motilal Oswal BSE Low Volatility Index Fund-Direct plan,15.0718,2026-03-30
149924,INF179KC1CC7,,HDFC FMP 1861D March 2022 - Growth Option - Direct Plan,13.0227,2026-03-30
149936,INF846K019H0,,Axis Nifty Midcap 50 Index Fund - Direct Plan - Growth Option,18.2083,2026-03-30
149961,INF205KA1585,,Invesco India - Invesco EQQQ Nasdaq-100 ETF Fund of Fund - Direct Plan - Growth,20.5895,2026-03-30
149966,INF336L01QH7,,HSBC CRISIL IBX 50:50 Gilt Plus SDL Apr 2028 Index Fund - Direct - Growth,12.998,2026-03-30
149970,INF740KA1QV9,,DSP Nifty SDL Plus G-Sec Jun 2028 30:70 Index Fund - Direct - Growth,13.0105,2026-03-30
149993,INF200KA13F0,,SBI Fixed Maturity Plan (FMP)- Series 61 (1927 Days)- Direct Plan- Growth option,12.9844,2026-03-30
149995,INF200KA14F8,,SBI Fixed Maturity Plan (FMP)- Series 61 (1927 Days)- Direct Plan- Income Distribution Cum Capital withdrawal option,12.9846,2026-03-30
149999,INF109KC14B6,,ICICI Prudential Nifty SDL Sep 2027 Index Fund - Direct Plan - Growth,12.929,2026-03-30
150002,INF179KC1CO2,,HDFC FMP 1876D March 2022 - Growth Option - Direct Plan,12.9751,2026-03-30
150012,INF204KC1527,,Nippon India Nifty AAA CPSE Bond Plus SDL - Apr 2027 Maturity 60:40 Index Fund - Direct Plan - Growth Option,12.7787,2026-03-30
150159,INF251K01HF3,,BARODA BNP PARIBAS ELSS Tax Saver Fund - Direct Plan - Growth Option,99.2168,2026-03-30
150169,INF251K01GJ7,,BARODA BNP PARIBAS LOW DURATION Fund - Direct Plan - Growth Option,45.8598,2026-03-30
150180,INF251K01GW0,,Baroda BNP Paribas Dynamic Bond Fund - Direct Plan - Growth Option,50.8153,2026-03-30
150187,INF251K01HN7,,BARODA BNP PARIBAS LARGE CAP Fund - Direct Plan - Growth Option,230.9749,2026-03-30
150206,INF251K01HR8,,BARODA BNP PARIBAS Conservative Hybrid Fund - Direct Plan - Growth Option,54.4911,2026-03-30
150212,INF251K01HQ0,,BARODA BNP PARIBAS Mid Cap Fund - Direct Plan - Growth Option,114.8959,2026-03-30
150237,INF251K01GP4,,BARODA BNP PARIBAS Corporate Bond Fund - Direct Plan - Growth Option,30.2939,2026-03-30
150251,INF251K01OT0,,BARODA BNP PARIBAS ARBITRAGE FUND-DIRECT PLAN-GROWTH OPTION,17.7851,2026-03-30
150260,INF251K01OZ7,,Baroda BNP Paribas Aggressive Hybrid Fund- DIRECT PLAN - GROWTH OPTION,29.6919,2026-03-30
150264,INF251K01PN0,,BARODA BNP PARIBAS Focused Fund - Direct Plan - Growth Option,21.6558,2026-03-30
150266,INF251K01PT7,,BARODA BNP PARIBAS India Consumption Fund - Direct Plan - Growth Option,30.329,2026-03-30
150285,INF251K01QT5,,Baroda BNP Paribas Aqua Fund of Fund - Direct Plan - Growth Option,15.1444,2026-03-30
150310,INF109KC10C2,,ICICI PRUDENTIAL HOUSING OPPORTUNITIES FUND - Direct Plan Growth,16.26,2026-03-30
150313,INF789F1AVH8,,UTI Nifty Midcap 150 Quality 50 Index Fund - Direct Plan - Growth Option,12.291,2026-03-30
150316,INF209KB14H3,,Aditya Birla Sun Life Fixed Term Plan - Series TQ (1879 days) - Direct Plan - Growth Option,12.9597,2026-03-30
150326,INF277KA1372,,Tata Nifty SDL Plus AAA PSU Bond Dec 6040 Index Fund- Direct Plan-Growth,13.0211,2026-03-30
150344,INF277KA1430,,Tata Nifty India Digital ETF Fund of Fund-Direct Plan-Growth,11.7388,2026-03-30
150346,INF03VN01530,,WhiteOak Capital Flexi Cap Fund Direct Plan-Growth,16.188,2026-03-30
150353,INF209KB19H2,,Aditya Birla Sun Life Crisil IBX 60:40 SDL+AAA PSU-Apr 2027 Index Fund-Direct Growth,12.8059,2026-03-30
150358,INF769K01IH8,,Mirae Asset Nifty SDL Jun 2027 Index Fund -Direct Plan - Growth,12.907,2026-03-30
150367,INF0J8L01065,,NJ Arbitrage Fund - Direct Plan - Growth Option,12.8029,2026-03-30
150369,INF0J8L01081,,NJ Overnight Fund - Direct Plan - Growth Option,1246.2462,2026-03-30
150376,INF754K01OP1,,Edelweiss Focused Fund - Direct Plan - Growth,15.715,2026-03-30
150379,INF200KA11M0,,SBI Fixed Maturity Plan (FMP) - Series 66 (1361 Days) - Direct Plan - Growth,12.9103,2026-03-30
150387,INF251K01QZ2,,Baroda BNP Paribas Flexi Cap Fund - Direct Plan - Growth Option,14.5172,2026-03-30
150390,INF082J01416,,Quantum Nifty 50 ETF Fund of Fund - Direct Plan - Growth,13.2633,2026-03-30
150392,INF767K01RE0,,LIC MF Money Market Fund-Direct Plan-Growth,1259.8332,2026-03-30
150404,INF194KB1DJ2,,BANDHAN MIDCAP FUND - GROWTH - DIRECT PLAN,16.386,2026-03-30
150407,INF582M01HW2,,Union Gilt Fund - Direct Plan - Growth Option,11.8796,2026-03-30
150410,INF789F1AVR7,,UTI Gilt Fund with 10 year Constant Duration - Direct Plan - Growth Option,12.8865,2026-03-30
150428,INF740KA1RB9,,DSP Nifty Midcap 150 Quality 50 Index Fund - Direct - Growth,12.675,2026-03-30
150440,INF966L01AT0,,quant Large Cap Fund - Growth Option - Direct Plan,13.7623,2026-03-30
150443,INF247L01BC9,,Motilal Oswal BSE Financials ex Bank 30 Index Fund Direct Growth,15.3019,2026-03-30
150452,INF109KC11D8,,ICICI Prudential Nifty 200 Momentum 30 Index Fund - Direct Plan - Growth,14.7144,2026-03-30
150460,INF200KA15M1,,SBI Fixed Maturity Plan (FMP) - Series 67 (1467 Days) - Direct Plan - Growth,12.9146,2026-03-30
150468,INF109KC13E2,,ICICI Prudential Nifty IT Index Fund - Direct Plan - Growth,10.2542,2026-03-30
150470,INF769K01IN6,,Mirae Asset Balanced Advantage Fund Direct Plan- Growth,14.32,2026-03-30
150481,INF090I01WQ5,,Franklin India Balanced Advantage Fund- Growth- Direct,14.2531,2026-03-30
150484,INF209KB17J2,,Aditya Birla Sun Life Long Duration Fund-Direct Growth,12.8837,2026-03-30
150487,INF204KC1584,,Nippon India Nifty Alpha Low Volatility 30 Index Fund - Direct Plan - Growth Option,14.406,2026-03-30
150505,INF760K01KC4,,Canara Robeco Banking and PSU Debt Fund- Direct Plan- Growth Option,12.5267,2026-03-30
150513,INF0GCD01503,,TRUSTMF MONEY MARKET FUND-DIRECT PLAN-GROWTH,1281.0921,2026-03-30
150515,INF959L01GD6,,Navi Nifty India Manufacturing Index Fund- Direct Plan- Growth,17.0388,2026-03-30
150518,INF247L01BF2,,Motilal Oswal BSE Enhanced Value Index Fund-Direct plan,25.6412,2026-03-30
150521,INF247L01BI6,,Motilal Oswal BSE Quality Index Fund-Direct plan,15.5624,2026-03-30
150532,INF277KA1497,,Tata Housing Opportunities Fund - Direct Plan - Growth,13.466,2026-03-30
150539,INF109KC12I5,,ICICI Prudential PSU Equity Fund - Direct Plan - Growth,21.39,2026-03-30
150545,INF192K01MP8,,JM Short Duration Fund (Direct) - Growth,12.7389,2026-03-30
150547,INF179KC1DC5,,HDFC FMP 1406D August 2022 - Growth Option - Direct Plan,12.8138,2026-03-30
150554,INF582M01IK5,,Union Retirement Fund - Direct Plan - Growth Option,15.16,2026-03-30
150562,INF680P01323,,Shriram Overnight Fund -  Direct Growth,12.4354,2026-03-30
150571,INF903JA1LE2,,Sundaram Flexicap Fund Direct Growth,13.7847,2026-03-30
150581,INF754K01OX5,,Edelweiss Gold and Silver ETF FOF - Direct Plan - Growth,33.397,2026-03-30
150584,INF03VN01597,,WhiteOak Capital Mid Cap Fund Direct Plan Growth,18.788,2026-03-30
150587,INF03VN01621,,WhiteOak Capital ELSS Tax Saver Fund Direct Plan Growth,16.101,2026-03-30
150591,INF194KB1DP9,,BANDHAN NIFTY200 MOMENTUM 30 INDEX FUND - GROWTH - DIRECT PLAN,13.8173,2026-03-30
150595,INF769K01IQ9,,Mirae Asset Global Electric & Autonomous Vehicles Equity Passive FOF - Direct Plan - Growth,14.835,2026-03-30
150597,INF769K01IS5,,Mirae Asset Global X Artificial Intelligence & Technology ETF Fund of Fund - Direct Plan- Growth,24.921,2026-03-30
150615,INF846K015J4,,Axis Silver Fund of Fund- Direct Plan-Growth Option,38.5458,2026-03-30
150624,INF174KA1JN6,,Kotak Business Cycle - Direct Plan - Growth,15.164,2026-03-30
150627,INF204KC1634,,Nippon India Fixed Maturity Plan-XLIV-Series 1-Direct Plan-Growth Option,13.0574,2026-03-30
150631,INF0K1H01040,,Samco Overnight Fund - Direct Plan - Growth Option,1230.0616,2026-03-30
150636,INF194KB1DV7,,BANDHAN NIFTY100 LOW VOLATILITY 30 INDEX FUND - GROWTH - DIRECT PLAN,14.3687,2026-03-30
150639,INF109KC10J7,,ICICI Prudential Nifty50 Equal Weight Index Fund- Direct Plan - Growth,15.3705,2026-03-30
150642,INF247L01BM8,,Motilal Oswal Gold and Silver Passive Fund of Funds(Direct Plan),29.8495,2026-03-30
150643,INF109KC16J4,,ICICI Prudential Nifty Auto Index Fund - Direct Plan - Growth,19.1007,2026-03-30
150649,INF200KA15O7,,SBI Fixed Maturity Plan (FMP) - Series 68 (1302 Days) - Direct Plan - Growth,12.7341,2026-03-30
150655,,,HDFC FMP 1359D September - Growth Option - Direct Plan,12.8251,2026-03-30
150659,INF767K01RK7,,LIC MF Multi Cap Fund-Direct Plan-Growth,15.8649,2026-03-30
150671,INF754K01PF9,,Edelweiss CRISIL IBX 50:50 Gilt Plus SDL April 2037 Index Fund - Direct Plan - Growth,12.9606,2026-03-30
150673,INF200KA10P5,,SBI Nifty Midcap 150 Index Fund - Direct Plan - Growth,16.9051,2026-03-30
150677,INF200KA16P2,,SBI Nifty Smallcap 250 Index Fund - Direct Plan - Growth,15.5659,2026-03-30
150681,INF200KA12Q9,,SBI |CRISIL IBX Gilt Index - June 2036 Fund - Direct Plan - Growth,13.013,2026-03-30
150685,INF109KC12K1,,ICICI PRUDENTIAL TRANSPORTATION AND LOGISTICS FUND - Direct Plan - Growth,18.58,2026-03-30
150688,INF209KB15M0,,Aditya Birla Sun Life Multi-Asset Passive FOF-Direct Growth,15.8783,2026-03-30
150698,INF209KB10N9,,Aditya Birla Sun Life Crisil IBX Gilt-April 2026 Index Fund-Direct Growth,12.729,2026-03-30
150702,INF209KB14N1,,Aditya Birla Sun Life Crisil IBX 50:50 Gilt Plus SDL Apr 2028 Index Fund-Direct Growth,13.0034,2026-03-30
150706,INF200KA18Q6,,SBI CRISIL IBX Gilt Index - April 2029 Fund - Direct Plan - Growth,13.0128,2026-03-30
150711,INF200KA14R3,,SBI CRISIL IBX SDL Index - September 2027 Fund - Direct Plan - Growth,12.9306,2026-03-30
150714,INF789F1AWB9,,UTI Gold ETF Fund of Fund - Direct Plan - Growth Option,28.0201,2026-03-30
150716,INF194KB1EB7,,BANDHAN TRANSPORTATION AND LOGISTICS FUND - GROWTH - DIRECT PLAN,17.852,2026-03-30
150725,INF174KA1JT3,,Kotak Nifty SDL Plus AAA PSU Bond Jul 2028 60:40 Index Fund Direct Plan - Growth,12.9182,2026-03-30
150727,INF754K01PN3,,Edelweiss CRISIL IBX 50:50 Gilt Plus SDL June 2027 Index Fund - Direct Plan - Growth,12.9228,2026-03-30
150729,INF109KC14L5,,ICICI Prudential Nifty SDL Dec 2028 Index Fund - Direct Plan - Growth,13.089,2026-03-30
150733,INF109KC18K8,,ICICI Prudential Nifty G-Sec Dec 2030 Index Fund - Direct Plan - Growth,12.9476,2026-03-30
150737,INF179KC1DU7,,HDFC Silver ETF Fund of Fund - Growth Option - Direct Plan,37.4507,2026-03-30
150738,INF277KA1612,,Tata Nifty Midcap 150 Momentum 50 Index Fund - Growth - Direct Plan,16.0216,2026-03-30
150746,INF194KB1EH4,,BANDHAN CRISIL IBX GILT APRIL 2026 INDEX FUND - DIRECT PLAN - GROWTH,12.71,2026-03-30
150751,INF846K012K9,,Axis NASDAQ 100 US Specific Equity Passive FOF - Direct Plan - Growth,23.3915,2026-03-30
150754,INF204KC1683,,Nippon India Nifty AAA PSU Bond Plus SDL - Sep 2026 Maturity 50:50 Index Fund-Direct Plan-Growth Option,12.7567,2026-03-30
150778,INF209KB12O3,,Aditya Birla Sun Life Crisil IBX Gilt-Apr-2029 Index Fund-Direct Growth,13.0632,2026-03-30
150788,INF769K01JD5,,Mirae Asset Nifty AAA PSU Bond Plus SDL Apr 2026 50:50 Index Fund - Direct Plan - Growth,12.7388,2026-03-30
150792,INF769K01IX5,,Mirae Asset CRISIL IBX Gilt Index - April 2033 Index Fund - Direct Plan - Growth,13.0219,2026-03-30
150797,INF03VN01696,,WhiteOak Capital Large Cap Fund Direct Plan Growth,14.092,2026-03-30
150805,INF179KC1DY9,,HDFC Business Cycle Fund - Growth Option - Direct Plan,13.11,2026-03-30
150807,INF754K01PV6,,Edelweiss CRISIL IBX 50:50 Gilt Plus SDL Sep 2028 Index Fund - Direct Plan - Growth,12.9358,2026-03-30
150815,INF192K01MV6,,JM Midcap Fund (Direct) - Growth,17.7157,2026-03-30
150817,INF760K01KI1,,Canara Robeco Mid Cap Fund- Direct Plan- Growth Option,15.99,2026-03-30
150822,INF174KA1KJ2,,Kotak Income Plus Arbitrage Omni FOF-Direct Plan-Growth,12.8515,2026-03-30
150824,INF204KC1741,,Nippon India Nifty SDL Plus G-Sec - Jun 2028 Maturity 70:30 Index Fund-Direct Plan-Growth Option,12.8029,2026-03-30
150833,INF789F1AWK0,,UTI Fixed Term Income Fund - Series XXXV-I (1260 Days) - Direct Plan - Growth Option,12.6801,2026-03-30
150838,INF0K1H01065,,Samco ELSS Tax Saver Fund - Direct Plan - Growth Option,11.51,2026-03-30
150842,INF740KA1RI4,,DSP FMP Series - 267 - 1246 Days - Direct - Growth,12.6794,2026-03-30
150845,INF179KC1EE9,,HDFC Nifty G-Sec Dec 2026 Index Fund - Growth Option - Direct Plan,12.7226,2026-03-30
150847,INF179KC1EH2,,HDFC Nifty G-Sec July 2031 Index Fund - Growth Option - Direct Plan,12.8338,2026-03-30
150854,INF846K018K6,,Axis Nifty SDL September 2026 Debt Index Fund - Direct Plan - Growth,12.7056,2026-03-30
150858,INF582M01IO7,,Union Multicap Fund - Direct Plan - Growth Option,15.06,2026-03-30
150865,INF251K01RF2,,Baroda BNP Paribas Multi Asset Fund - Direct Plan - Growth Option,15.5259,2026-03-30
150868,INF194KB1ET9,,BANDHAN CRISIL IBX 90:10 SDL PLUS GILT - NOV 2026 INDEX FUND - DIRECT GROWTH,12.7461,2026-03-30
