scheme_code,isin_growth,isin_div_reinv,scheme_name,nav,date
125345,INF579M01621,,360 ONE LIQUID FUND DIRECT PLAN  GROWTH,2110.7354,2026-03-30
125354,INF846K01K35,,Axis Small Cap Fund - Direct Plan - Growth,108.18,2026-03-30
125497,INF200K01T51,,SBI Small Cap Fund - Direct Plan - Growth,169.3708,2026-03-30
125503,INF200K01V08,,SBI BANKING & PSU FUND - Direct Plan - Growth,3417.8558,2026-03-30
125597,INF209K014W1,,Aditya Birla Sun Life Banking and Financial Services Fund - Direct Plan - Growth,61.71,2026-03-30
125711,INF680P01042,,Shriram Aggressive Hybrid Fund- Direct Growth,33.8751,2026-03-30
126353,INF205K01A24,,Invesco India - Invesco Pan European Equity Fund of Fund - Direct Plan - Growth Option,24.5737,2026-03-30
126389,INF761K01CS5,,BANK OF INDIA Ultra Short Duration Fund- Direct Plan-Bonus,3403.7224,2026-03-30
126393,INF740K01K81,,DSP Dynamic Asset Allocation Fund - Direct Plan - Growth,31.148,2026-03-30
126685,INF760K01HB2,,CANARA ROBECO CORPORATE BOND FUND - DIRECT PLAN - GROWTH OPTION,23.9923,2026-03-30
126940,INF789F015Z6,,UTI Banking & PSU Fund - Direct Plan - Growth Option,23.2447,2026-03-30
127042,INF247L01445,,Motilal Oswal Midcap Fund-Direct Plan-Growth Option,92.9573,2026-03-30
127850,INF761K01BO6,,BANK OF INDIA BALANCED ADVANTAGE FUND DIRECT PLAN  GROWTH,26.7562,2026-03-30
128006,INF174K01VQ5,,Kotak Medium Term Fund - Direct Growth,26.4692,2026-03-30
128051,INF179KA1FZ3,,HDFC Credit Risk Debt Fund - Growth Option - Direct Plan,27.2195,2026-03-30
128079,INF174K01VS1,INF174K01VU7,Kotak Medium Term Fund - Direct - Standard Income Distribution cum capital withdrawal option,26.4716,2026-03-30
128629,INF179KA1IZ7,,HDFC Banking and PSU Debt Fund - Growth Option - Direct Plan,24.7215,2026-03-30
129008,INF090I01KR8,,Franklin India Banking & PSU Debt Fund - Direct - Growth,24.4479,2026-03-30
129046,INF247L01502,,Motilal Oswal Flexi cap Fund Direct Plan-Growth Option,56.9212,2026-03-30
129052,INF179KA1KT6,,HDFC ARBITRAGE FUND - Wholesale Growth Option - Direct Plan,21.147,2026-03-30
129188,INF205K01B49,,Invesco India - Invesco Global Equity Income Fund of Fund - Direct Plan - Growth,35.5601,2026-03-30
129193,INF336L01IJ0,,HSBC Multi Asset Active FOF - Growth Direct,39.2414,2026-03-30
129197,INF336L01IP7,,HSBC Income Plus Arbitrage Active FOF - Growth Direct,23.5258,2026-03-30
129200,INF336L01ID3,,HSBC Aggressive Hybrid Active FOF - Growth Direct,39.3551,2026-03-30
129212,INF903J01F92,,Sundaram Infrastructure Advantage Fund Direct Plan - Growth,96.7581,2026-03-30
129649,INF582M01BU9,,Union Small Cap Fund - Direct Plan - Growth Option,50.4,2026-03-30
130050,INF204KA1QF1,,Nippon India Medium Duration Fund - Direct Plan - Growth Option,17.7376,2026-03-30
130052,INF204KA1QG9,,Nippon India Medium Duration Fund - Direct Plan - Bonus Option,17.7412,2026-03-30
130206,INF754K01EA4,,Edelweiss Arbitrage Fund- Direct Plan- Growth Option,21.818,2026-03-30
130314,INF846K01PJ5,,Axis Credit Risk Fund - Direct Plan - Growth,25.2903,2026-03-30
130493,INF740K01Z50,,DSP Income Plus Arbitrage Omni FoF - Direct Plan - Growth,23.2112,2026-03-30
130498,INF179KA1RQ7,,HDFC Large and Mid Cap Fund - Growth Option - Direct Plan,316.557,2026-03-30
130503,INF179KA1RW5,,HDFC Small Cap Fund - Growth Option - Direct Plan,135.383,2026-03-30
130543,INF179KA1SC5,,HDFC Income Plus Arbitrage Active FOF - Growth Option - Direct Plan,44.3966,2026-03-30
130604,INF192K01GL9,,JM Arbitrage Fund (Direct) - Bonus Option - Principal Units,19.4978,2026-03-30
130722,INF205K01I83,,Invesco India Credit Risk Fund - Direct Plan - Growth,2238.8615,2026-03-30
130773,INF846K01PZ1,,Axis Arbitrage Fund - Direct Plan - Growth,21.3056,2026-03-30
130787,INF205K01P68,,Invesco India Arbitrage Fund - Direct Plan - Annual Bonus,36.2172,2026-03-30
130860,INF204KA1SI1,,Nippon India Japan Equity Fund- Direct Plan- Growth Plan- Growth Option,27.0984,2026-03-30
130861,INF204KA1SK7,,Nippon India Japan Equity Fund- Direct Plan- Growth Plan- Bonus Option,27.0984,2026-03-30
130904,INF192K01HB8,,JM Aggressive Hybrid Fund (Direct) - Annual Bonus Option,122.2998,2026-03-30
131061,INF109KA1O37,,ICICI Prudential Constant Maturity Gilt Fund - Direct Plan - Growth,25.581,2026-03-30
131301,INF740K019I5,,DSP 10Y G-Sec Fund - Direct Plan - Growth,22.3565,2026-03-30
131355,INF194KA1UH1,,BANDHAN Balanced Advantage Fund Direct Plan Growth,26.76,2026-03-30
131373,INF174K01D28,,Kotak Equity Savings Fund - Direct - Growth,28.6582,2026-03-30
131375,INF174K01D36,INF174K01D51,Kotak Equity Savings Fund - Direct - Monthly Payout of Income Distribution cum capital withdrawal option,20.5738,2026-03-30
131580,INF579M01902,,360 ONE Focused Fund-Direct Plan-Growth,47.2092,2026-03-30
131670,INF084M01DJ5,,Aditya Birla Sun Life Balanced Advantage Fund - Direct Plan - Growth Option,116.95,2026-03-30
131865,INF084M01DM9,,Aditya Birla Sun Life Multi Asset Omni FoF- Direct Plan - Growth Option,36.1282,2026-03-30
131898,INF084M01DP2,,Aditya Birla Sun Life Income Plus Arbitrage Active FOF- Direct Plan - Growth Option,41.0081,2026-03-30
132183,INF084M01EQ8,,Aditya Birla Sun Life Conservative Hybrid Active FOF- Direct Plan - Growth Option,36.0565,2026-03-30
132185,INF084M01ET2,,Aditya Birla Sun Life Aggressive Hybrid Omni FOF- Direct Plan - Growth Option,42.117,2026-03-30
132186,INF084M01EW6,,Aditya Birla Sun Life Dynamic Asset Allocation Omni FOF- Direct Plan - Growth Option,55.9536,2026-03-30
132756,INF277K01I86,,Tata ELSS Fund-Growth-Direct Plan,46.7741,2026-03-30
132989,INF090I01LH7,,Franklin India Income Plus Arbitrage Active Fund of Funds- Growth Plan - Direct,24.6133,2026-03-30
132995,INF209KA1TP9,,Aditya Birla Sun Life Equity Savings Fund - Direct Plan - Growth,24.85,2026-03-30
133035,INF174K01F00,,Kotak Aggressive Hybrid Fund - Direct Plan -Growth,68.124,2026-03-30
133054,INF109KA11J9,,ICICI Prudential Equity Savings Fund - Direct Plan - Cumulative option,24.35,2026-03-30
133265,INF204KA1YV2,,Nippon India Gilt  Fund- Direct Plan- Growth Plan- Bonus Option,23.7316,2026-03-30
133386,INF247L01569,,Motilal Oswal ELSS Tax Saver Fund - Direct Plan - Growth Option,52.922,2026-03-30
133395,INF192K01GX4,,JM Arbitrage Fund (Direct) - Annual Bonus Option - Principal Units,18.714,2026-03-30
133488,INF955L01FR6,,Baroda BNP Paribas Credit Risk Fund -Direct-Growth Option,25.6723,2026-03-30
133516,INF209KA1YK0,,Aditya Birla Sun Life Manufacturing Equity Fund - Direct Plan - Growth,34.36,2026-03-30
133568,INF204KA1B72,,Nippon India Retirement Fund- Wealth Creation Scheme- Direct Plan- Growth Plan - Growth Option,28.8496,2026-03-30
133569,INF204KA1C30,,Nippon India Retirement Fund- Income Generation Scheme- Direct Plan- Growth Plan - Growth Option,22.1977,2026-03-30
133629,INF204KA1C55,,Nippon India Retirement Fund- Income Generation Scheme- Direct Plan-Growth Plan- Bonus Option,22.1977,2026-03-30
133630,INF204KA1B98,,Nippon India Retirement Fund- Wealth Creation Scheme- Direct Plan-Growth Plan- Bonus Option,28.8496,2026-03-30
133710,INF767K01NE9,,LIC MF Large & Mid Cap Fund-Direct Plan-Growth,39.3849,2026-03-30
133791,INF178L01BY0,,Kotak Corporate Bond Fund- Direct Plan- Growth Option,4080.1743,2026-03-30
133792,INF178L01BZ7,,Kotak Corporate Bond Fund- Direct Plan- Monthly Payout of Income Distribution cum capital withdrawal option,1067.6103,2026-03-30
133800,INF178L01AK1,INF178L01AJ3,Kotak Infrastructure & Economic Reform Fund- Direct Plan- Payout of Income Distribution cum capital withdrawal option,68.445,2026-03-30
133801,INF178L01AL9,,Kotak Infrastructure & Economic Reform Fund- Direct Plan- Growth Option,69.237,2026-03-30
133810,INF178L01AX4,,Kotak Low Duration Fund- Direct Plan- Growth Option,3816.8115,2026-03-30
133812,INF178L01AZ9,INF178L01AY2,Kotak Low Duration Fund - Direct Plan- Standard Income Distribution cum capital withdrawal option,1520.8635,2026-03-30
133839,INF663L01FF1,,PGIM India Flexi Cap Fund - Direct Plan - Growth Option,37.76,2026-03-30
133859,INF200KA1507,,SBI BANKING & FINANCIAL SERVICES FUND - DIRECT PLAN - GROWTH,44.3104,2026-03-30
133868,INF761K01DG8,,BANK OF INDIA Credit Risk  Fund - Direct Plan,13.7149,2026-03-30
133925,INF740K013Q1,,DSP Low Duration Fund - Direct Plan - Growth,21.3573,2026-03-30
134017,INF767K01NK6,,LIC MF Banking and Financial Services Fund-Direct Plan-Growth,21.6841,2026-03-30
134387,INF209KA1K88,,Aditya Birla Sun Life Credit Risk Fund - Direct Plan - Growth,26.8772,2026-03-30
134388,INF209KA1L12,,Aditya Birla Sun Life Credit Risk Fund - Direct Plan - Bonus,26.8761,2026-03-30
134494,INF082J01176,,Quantum Dynamic Bond Fund - Direct Plan Growth Option,22.0248,2026-03-30
134503,INF789FB1KE6,,UTI Medium Duration Fund - Direct Plan - Growth Option,20.1119,2026-03-30
134547,INF204KA1U53,,Nippon India Banking and PSU  Fund- Direct Plan-Growth Plan- Growth Option,22.1896,2026-03-30
134552,INF204KA1U61,,Nippon India Banking and PSU Fund- Direct Plan-Growth Plan- Bonus Option,22.1891,2026-03-30
134594,INF204KA1W77,,Nippon India Equity Savings Fund- Direct Plan- Growth Plan-Growth Option,17.6726,2026-03-30
134595,INF204KA1W85,,Nippon India Equity Savings Fund- Direct Plan- Growth Plan- Bonus Option,17.6726,2026-03-30
134643,INF200KA1DF3,,SBI Equity Savings Fund - Direct Plan - Growth,26.4356,2026-03-30
134813,INF769K01DH9,,Mirae Asset Aggressive Hybrid Fund - Direct Plan - Growth,35.708,2026-03-30
134923,INF204KA15G5,,Nippon India US Equity Opportunities Fund- Direct Plan- Growth Plan- Growth Option,38.9528,2026-03-30
135120,INF846K01VJ3,,Axis Equity Savings Fund - Direct Plan - Growth,24.8,2026-03-30
135341,INF666M01BE4,,Groww Value Fund (formerly known as Indiabulls Value Fund) - Direct Plan - Growth Option,28.5514,2026-03-30
135342,INF666M01BF1,INF666M01BG9,Groww Value Fund (formerly known as Indiabulls Value Fund)- Direct Plan- - Income Distribution cum capital withdrawal Option (Payout & Reinvestment),28.4456,2026-03-30
135500,INF174K01Z14,INF174K01Z22,Kotak Bond Short Term Plan - Direct - Standard Income Distribution cum capital withdrawal option,15.7948,2026-03-30
135601,INF663L01FN5,,PGIM India ELSS Tax Saver Fund - Direct Plan - Growth Option,34.36,2026-03-30
135654,INF959L01CD5,,Navi ELSS Tax Saver Fund- Direct Plan- Growth Option,30.5455,2026-03-30
135677,INF959L01CH6,,Navi Large & Midcap Fund- Direct Plan- Growth Option,37.3314,2026-03-30
135762,INF846K01WO1,,Axis Children's Fund - Lock in - Direct Growth,27.3876,2026-03-30
135764,INF846K01WR4,,Axis Children's Fund - No Lock in - Direct Growth,27.9114,2026-03-30
135781,INF769K01DM9,,Mirae Asset ELSS Tax Saver Fund - Direct Plan - Growth,49.631,2026-03-30
135789,INF277K01Z28,,TATA Banking & Financial Services Fund Direct Plan - Payout of Income Distribution cum capital withdrawal option,45.4342,2026-03-30
135792,,INF277K01Z36,TATA Banking & Financial Services Fund Direct Plan - Reinvestment of Income Distribution cum capital withdrawal option,45.4342,2026-03-30
135793,INF277K01Z10,,Tata Banking And Financial Services Fund-Direct Plan-Growth,45.4342,2026-03-30
135795,INF277K01Z85,,TATA Digital India Fund Direct Plan - Payout of Income Distribution cum capital withdrawal option,43.8712,2026-03-30
135798,,INF277K01Z93,TATA Digital India Fund Direct Plan - Reinvestment of Income Distribution cum capital withdrawal option,43.8712,2026-03-30
135800,INF277K01Z77,,Tata Digital India Fund-Direct Plan-Growth,43.8712,2026-03-30
135801,,INF277K015A1,TATA India Consumer Fund Direct Plan - Reinvestment of Income Distribution cum capital withdrawal option,44.5267,2026-03-30
135805,INF277K013A6,,Tata India Consumer Fund-Direct Plan-Growth,44.5267,2026-03-30
135806,INF277K014A4,,TATA India Consumer Fund Direct Plan - Payout of Income Distribution cum capital withdrawal option,44.5267,2026-03-30
135807,INF277K010B0,,TATA India Pharma & Health Care Fund Direct Plan - Payout of Income Distribution cum capital withdrawal option,33.0207,2026-03-30
135808,,INF277K011B8,TATA India Pharma & Healthcare Fund Direct Plan - Reinvestment of Income Distribution cum capital withdrawal option,33.0207,2026-03-30
135810,INF277K019A3,,Tata India Pharma & Healthcare Fund-Direct Plan-Growth,33.0207,2026-03-30
135813,INF277K015B9,,Tata Resources & Energy Fund-Direct Plan-Growth,51.0603,2026-03-30
135816,,INF277K017B5,TATA Resources & Energy Fund Direct Plan - Reinvestment of Income Distribution cum capital withdrawal option,51.0603,2026-03-30
135817,INF277K016B7,,TATA Resources & Energy Fund Direct Plan - Payout of Income Distribution cum capital withdrawal option,51.0603,2026-03-30
135916,INF194KA1M23,,BANDHAN Corporate Bond Fund - Direct Growth,20.5257,2026-03-30
136007,INF200KA1HN8,,SBI Long Term Advantage Fund - Series III - Direct Plan - Growth,42.7322,2026-03-30
136094,INF179KB1MF0,,HDFC Retirement Savings Fund - Equity Plan - Growth Option - Direct Plan,51.01,2026-03-30
136464,INF179KB1MH6,,HDFC Retirement Savings Fund - Hybrid-Equity Plan - Growth Option - Direct Plan,39.871,2026-03-30
136465,INF179KB1MJ2,,HDFC Retirement Savings Fund - Hybrid-Debt Plan - Growth Option - Direct Plan,23.9652,2026-03-30
136567,INF740KA1504,,DSP Equity Savings Fund - Direct Plan - Growth,24.455,2026-03-30
138299,INF223J01NS5,,PGIM India Liquid Fund - Direct Plan - Growth,359.3335,2026-03-30
138312,INF663L01GR4,,PGIM India Large Cap Fund - Direct Plan - Growth,357.8,2026-03-30
138330,INF223J01OO2,,PGIM India Corporate Bond Fund - Direct Plan - Growth,49.6385,2026-03-30
138358,INF223J01QO7,,PGIM India Ultra Short Duration Fund - Direct Plan - Growth,37.1688,2026-03-30
138376,INF223J01QD0,,PGIM India Equity Savings Fund - Direct Plan - Growth,55.7648,2026-03-30
138386,INF663L01GX2,,PGIM India Aggressive Hybrid Equity Fund - Direct Plan - Growth,140.3,2026-03-30
138456,INF223J01NL0,,PGIM India Emerging Markets Equity Fund of Fund - Direct Plan - Growth,22.59,2026-03-30
138472,INF223J01ND7,,PGIM India Gilt Fund - Direct Plan - Growth,32.3123,2026-03-30
138528,INF223J01NF2,,PGIM India Global Equity Opportunities Fund of Fund- Direct Plan - Growth,47.28,2026-03-30
138875,INF223J013N7,,PGIM India Arbitrage Fund - Direct Plan - Growth,20.5308,2026-03-30
139527,INF761K01DM6,,BANK OF INDIA MID & SMALL CAP EQUITY & DEBT FUND - DIRECT PLAN GROWTH,39.15,2026-03-30
139538,INF174V01044,,Mahindra Manulife Liquid Fund - Direct Plan -Growth,1794.3692,2026-03-30
139711,INF903JA1443,,Sundaram Long Term Micro Cap Tax Advantage Fund Series III Direct Plan - Growth,29.6769,2026-03-30
139781,INF174V01093,,Mahindra Manulife ELSS Tax Saver Fund - Direct Plan -Growth,29.8288,2026-03-30
139872,INF247L01635,,Motilal Oswal Balanced Advantage Fund  (MOFDYNAMIC) - Direct Plan - Growth Option,18.8194,2026-03-30
139990,INF903JA1526,,Sundaram Long Term Micro Cap Tax Advantage Fund Series IV Direct Plan - Growth,25.6965,2026-03-30
140175,INF843K01AL0,,Edelweiss Large & Mid Cap Fund - Direct Plan - Growth Option,93.694,2026-03-30
140194,INF754K01GY9,,Edelweiss Liquid Fund - Direct Plan - Bonus Option,2071.2382,2026-03-30
140196,INF754K01GM4,,Edelweiss Liquid Fund - Direct Plan - Growth Option,3560.1651,2026-03-30
140228,INF843K01AO4,,Edelweiss Mid Cap Fund - Direct Plan - Growth Option,108.429,2026-03-30
140237,INF843K01CE1,,Edelweiss Money Market Fund - Direct Plan - Growth Option,32.7886,2026-03-30
140243,INF843K01AU1,,Edelweiss Greater China Equity Off-shore Fund - Direct Plan - Growth Option,63.199,2026-03-30
140256,INF843K01AW7,,Edelweiss ASEAN Equity Off-shore Fund - Direct Plan - Growth Option,37.913,2026-03-30
140274,INF843K01EC1,,Edelweiss US Value Equity Offshore Fund - Direct Plan - Growth Option,41.754,2026-03-30
140286,INF843K01FC8,,Edelweiss Banking and PSU Debt Fund - Direct Plan - Growth Option,26.3062,2026-03-30
140296,INF843K01GI3,,Edelweiss Europe Dynamic Equity Offshore Fund - Growth Option - Direct Plan,30.6963,2026-03-30
140298,INF843K01GS2,,Edelweiss Government Securities Fund - Direct Plan - Growth Option,25.9065,2026-03-30
140327,INF843K01IZ3,,Edelweiss Emerging Markets Opportunities Equity Offshore Fund - Direct Plan - Growth Option,25.3734,2026-03-30
140347,INF843K01KC8,,Edelweiss Equity Savings Fund - Direct Plan - Growth Option,28.1549,2026-03-30
140350,INF843K01KD6,,Edelweiss Equity Savings Fund - Direct Plan - Bonus Option,28.1662,2026-03-30
140353,INF843K01KK1,,Edelweiss Flexi Cap Fund - Direct Plan - Growth Option,40.549,2026-03-30
140382,INF194KA1U56,,Bandhan Aggressive Hybrid Fund-Direct Plan Growth,27.909,2026-03-30
140444,INF174V01184,,Mahindra Manulife Equity Savings Fund - Direct Plan -Growth,24.0643,2026-03-30
140487,INF200KA1LS9,,SBI Long Term Advantage Fund - Series IV - Direct Plan - Growth,44.462,2026-03-30
140603,INF194KA1X61,,BANDHAN Credit Risk Fund-Direct Plan-Growth,18.4414,2026-03-30
140613,INF174V01267,,Mahindra Manulife Low Duration Fund - Direct Plan -Growth,1833.6266,2026-03-30
140769,INF769K01DR8,,Mirae Asset Dynamic Bond Fund -Direct Plan -Growth,18.4425,2026-03-30
140809,INF666M01CM5,INF666M01CN3,Groww Largecap Fund (formerly known as Indiabulls Bluechip Fund)- Direct Plan- Monthly - Income Distribution cum capital withdrawal Option (Payout & Reinvestment),20.87,2026-03-30
140811,INF666M01CO1,INF666M01CP8,Groww Largecap Fund (formerly known as Indiabulls Bluechip Fund)- Direct Plan- Quarterly - Income Distribution cum capital withdrawal Option (Payout & Reinvestment),26.07,2026-03-30
140814,INF666M01CQ6,INF666M01CR4,Groww Largecap Fund (formerly known as Indiabulls Bluechip Fund)- Direct Plan- Half Yearly -Income Distribution cum capital withdrawal Option (Payout & Reinvestment),26.27,2026-03-30
140815,INF666M01CY0,INF666M01CZ7,Groww Value Fund (formerly known as Indiabulls Value Fund)- Direct Plan- Monthly - Income Distribution cum capital withdrawal Option (Payout & Reinvestment),20.9393,2026-03-30
140817,INF666M01DA8,INF666M01DB6,Groww Value Fund (formerly known as Indiabulls Value Fund)- Direct Plan- Quarterly - Income Distribution cum capital withdrawal Option (Payout & Reinvestment),22.8425,2026-03-30
140819,INF666M01DC4,INF666M01DD2,Groww Value Fund (formerly known as Indiabulls Value Fund)- Direct Plan- Half Yearly - Income Distribution cum capital withdrawal Option (Payout & Reinvestment),22.8605,2026-03-30
141141,INF903JA1955,,Sundaram Long Term Micro Cap Tax Advantage Fund Series V Direct Plan - Growth,25.1923,2026-03-30
141226,INF174V01341,,Mahindra Manulife Multi Cap Fund - Direct Plan -Growth,37.7795,2026-03-30
141248,INF582M01CU7,,Union Largecap Fund - Direct Plan - Growth Option,22.35,2026-03-30
141564,INF903JA1AZ0,,Sundaram Long Term Micro Cap Tax Advantage Fund Series VI Direct Plan - Growth,24.362,2026-03-30
141588,INF846K01ZM8,,Axis Corporate Bond Fund - Direct Plan Growth,18.7535,2026-03-30
141642,INF846K01A29,,Axis Balanced Advantage Fund - Direct Plan - Growth,22.5,2026-03-30
141808,INF666M01DK7,,Groww ELSS Tax Saver Fund (formerly known as Indiabulls Tax Savings Fund)- Direct Plan- Growth Option,19.63,2026-03-30
141841,INF109KB10X0,,ICICI Prudential BSE Sensex Index Fund - Direct Plan - Cumulative Option,23.8766,2026-03-30
141877,INF740KA1CR7,,DSP Nifty 50 Equal Weight Index Fund - Direct Plan - Growth,24.6188,2026-03-30
141924,INF179KC1AU3,,HDFC Housing Opportunities Fund  - Growth Option - Direct Plan,21.083,2026-03-30
141925,INF846K01B28,,Axis Flexi Cap Fund - Direct Plan - Growth,26.07,2026-03-30
141950,INF761K01DS3,,BANK OF INDIA Mid Cap Tax Fund Series 1 Direct Plan Growth,25.11,2026-03-30
142038,INF582M01DE9,,Union Balanced Advantage Fund - Direct Plan - Growth Option,20.6,2026-03-30
142110,INF174V01507,,Mahindra Manulife Mid Cap Fund - Direct Plan -Growth,35.1943,2026-03-30
142134,INF109KC1093,,ICICI Prudential Long Term Wealth Enhancement Fund - Direct Plan Cumulative Option,26.99,2026-03-30
142138,INF200KA1RW8,,SBI Long Term Advantage Fund - Series V - Direct Plan - Growth,27.9129,2026-03-30
142153,INF903JA1BT1,,Sundaram Long Term Tax Advantage Fund Series III Direct Plan - Growth,26.1839,2026-03-30
142283,INF740KA1DN4,,DSP Arbitrage Fund - Direct - Growth,16.394,2026-03-30
142388,INF754K01ML4,,Edelweiss Recently Listed IPO Fund Direct Plan Growth,25.6585,2026-03-30
142641,INF769K01DX6,,Mirae Asset Short Duration Fund - Direct Plan - Growth,17.2914,2026-03-30
143079,INF903JA1CZ6,,Sundaram Long Term Tax Advantage Fund Series IV Direct Plan - Growth,30.1116,2026-03-30
143163,INF959L01CX3,,Navi Aggressive Hybrid Fund - Direct Plan - Growth,21.6156,2026-03-30
143178,INF200KA1TO1,,SBI Long Term Advantage Fund - Series VI - Direct Plan - Growth,27.0578,2026-03-30
143241,INF582M01DU5,,Union Corporate Bond Fund - Direct Plan - Growth Option,16.071,2026-03-30
143269,INF879O01068,,Parag Parikh Liquid Fund- Direct Plan- Growth,1523.1801,2026-03-30
143341,INF789FC12T1,,UTI Nifty Next 50 Index Fund - Direct Plan - Growth Option,22.3607,2026-03-30
143494,INF204K01YH3,,Nippon India Ultra Short Duration Fund- Direct Plan- Growth Option,4660.4418,2026-03-30
143508,INF955L01HA8,,Baroda BNP Paribas Ultra Short Duration Fund- Direct Plan- Growth,1632.632,2026-03-30
143537,INF205K014Q7,,Invesco India Aggressive Hybrid Fund - Direct Plan - Growth,22.036,2026-03-30
143610,INF192K01FL1,,JM Low Duration Fund (Direct) - Bonus Option - Principal Units,23.942,2026-03-30
143612,INF192K01DW3,,JM Low Duration Fund (Direct) - Growth,39.7644,2026-03-30
143614,INF761K01ED3,,BANK OF INDIA Arbitrage Fund Direct Plan Growth,15.0626,2026-03-30
143704,INF204KB1YQ1,,Nippon India Nivesh Lakshya Long Duration Fund- Direct Plan- Growth Option,17.828,2026-03-30
143783,INF769K01ED6,,Mirae Asset Healthcare Fund Direct Growth,42.591,2026-03-30
143793,INF959L01DT9,,Navi Flexi Cap Fund - Direct Plan - Growth,24.1491,2026-03-30
143874,INF109KC1GH2,,ICICI Prudential Pharma Healthcare and Diagnostics (P.H.D) Fund - Direct Plan - Cumulative Option,39.68,2026-03-30
143903,INF109KC1FX1,,ICICI Prudential BHARAT 22 FOF - Direct Plan Cumulative Option,33.3147,2026-03-30
144173,INF194KA16R3,,BANDHAN ULTRA SHORT DURATION FUND - DIRECT PLAN GROWTH,16.1011,2026-03-30
144312,INF582M01EC1,,Union Equity Savings Fund - Direct Plan - Growth Option,17.18,2026-03-30
144315,INF761K01EL6,,BANK OF INDIA Midcap Tax Fund Series 2 Direct Plan Growth,29.56,2026-03-30
144334,INF174KA1194,INF174KA1202,Kotak Balanced Advantage Fund -Direct Plan  -Payout of Income Distribution cum capital withdrawal option,21.155,2026-03-30
144335,INF174KA1210,,Kotak Balanced Advantage Fund  - Direct Plan -Growth Option,21.155,2026-03-30
144339,INF789F1A538,,UTI Corporate Bond Fund - Direct Plan - Growth Option,17.3244,2026-03-30
144394,INF846K01E25,,Axis Aggressive Hybrid Fund - Direct Plan - Growth Option,20.93,2026-03-30
144403,INF174V01580,,Mahindra Manulife Dynamic Bond Fund - Direct Plan - Growth,15.7965,2026-03-30
144466,INF090I01PD7,,Franklin India Equity Savings Fund- Growth Direct,18.1234,2026-03-30
144490,INF789F1A777,,UTI Equity Savings Fund - Direct Plan - Growth Option,19.4793,2026-03-30
144543,,INF277K016K8,TATA Flexi Cap Fund Direct Plan - Reinvestment of Income Distribution cum capital withdrawal option,24.1384,2026-03-30
144546,INF277K015K0,,Tata Flexi Cap Fund-Direct Plan-Growth,24.1384,2026-03-30
144547,INF277K017K6,,TATA Flexi Cap Fund - Direct Plan - Payout of Income Distribution cum capital withdrawal option,24.1384,2026-03-30
144646,INF740KA1KE8,,DSP Corporate Bond Fund - Direct - Growth,16.9382,2026-03-30
144754,INF846K01F40,,Axis Ultra Short Duration Fund - Direct Plan Growth,16.3683,2026-03-30
144835,INF903JA1FA2,,Sundaram Services Fund Direct Plan - Growth,33.0246,2026-03-30
144905,INF680P01109,,Shriram Flexi Cap Fund - Direct Growth,20.2248,2026-03-30
145034,INF179KB15Q6,,HDFC Ultra Short Term Fund - Direct Plan-Growth Option,16.189,2026-03-30
145050,INF903JA1FR6,,Sundaram Money Market Fund Direct Plan - Growth,15.7834,2026-03-30
145075,INF109KC1LJ8,,ICICI Prudential Manufacturing Fund - Direct Plan - Cumulative Option,35.72,2026-03-30
145110,INF846K01J46,,Axis Large & Mid Cap Fund - Direct Plan - Growth,32.71,2026-03-30
145137,INF205K013T3,,Invesco India Smallcap Fund - Direct Plan - Growth,41.05,2026-03-30
145206,INF277K011O1,,Tata Small Cap Fund-Direct Plan-Growth,34.3005,2026-03-30
145207,INF277K013O7,,TATA SmallCap Fund - Direct Plan - Payout of Income Distribution cum capital withdrawal option,34.3005,2026-03-30
145209,,INF277K012O9,TATA Small Cap Fund Direct Plan - Reinvestment of Income Distribution cum capital withdrawal option,34.3005,2026-03-30
145295,INF789F1ACX5,,UTI - Floater Fund - Direct Plan - Growth Option,1633.8946,2026-03-30
145356,INF174V01663,,Mahindra Manulife Consumption Fund - Direct Plan -Growth,21.9253,2026-03-30
145396,INF955L01HF7,,Baroda BNP Paribas Balanced Advantage Fund-Direct Plan-Growth Option,25.2957,2026-03-30
145454,INF740KA1LG1,,DSP Healthcare Fund - Direct Plan - Growth,40.073,2026-03-30
145473,INF582M01EK4,,Union Value Fund - Direct Plan - Growth Option,27.47,2026-03-30
145486,INF209KB1ZH2,,ADITYA BIRLA SUN LIFE OVERNIGHT FUND-DIRECT PLAN-GROWTH,1456.4586,2026-03-30
145536,INF109KC11G1,,ICICI Prudential Overnight Fund - Direct Plan - Growth,1451.1269,2026-03-30
145552,INF247L01718,,Motilal Oswal Nasdaq 100 Fund of Fund- Direct Plan Growth,48.8764,2026-03-30
145589,INF666M01EK5,,Groww Dynamic Bond Fund (formerly known as Indiabulls Dynamic Bond Fund) - Direct Plan - Growth option,1539.4473,2026-03-30
145591,INF666M01EQ2,INF666M01ER0,Groww Dynamic Bond Fund (formerly known as Indiabulls Dynamic Bond Fund)- Direct Plan- Monthly - Income Distribution cum capital withdrawal Option (Payout & Reinvestment),1007.7587,2026-03-30
145595,INF666M01EO7,INF666M01EP4,Groww Dynamic Bond Fund (formerly known as Indiabulls Dynamic Bond Fund)- Direct Plan- Fortnightly - Income Distribution cum capital withdrawal Option (Payout & Reinvestment),1016.3893,2026-03-30
145596,,INF666M01EL3,Groww Dynamic Bond Fund (formerly known as Indiabulls Dynamic Bond Fund)- Direct Plan- - Income Distribution cum capital withdrawal Option ( Reinvestment),1013.92,2026-03-30
