scheme_code,isin_growth,isin_div_reinv,scheme_name,nav,date
149303,INF194KB1CL0,,BANDHAN MULTI CAP FUND - GROWTH - DIRECT PLAN,16.503,2026-03-24
149307,INF200KA12B1,,SBI Fixed Maturity Plan (FMP) - Series 54 (1842 Days) - Direct Plan - Growth,13.0467,2026-03-24
149318,INF579M01AI2,,360 ONE QUANT FUND DIRECT GROWTH,18.4816,2026-03-24
149319,INF579M01AJ0,INF579M01AK8,360 ONE QUANT FUND DIRECT INCOME DISTRIBUTION CUM CAPITAL WITHDRAWAL,18.4816,2026-03-24
149321,INF00XX01BU6,,ITI Banking and Financial Services Fund - Direct Plan - Growth Option,15.6939,2026-03-24
149329,INF204KC1303,,Nippon India Taiwan Equity Fund- Direct Plan- Growth Option,26.3382,2026-03-24
149331,INF109KC1V91,,ICICI Prudential BSE 500 ETF FOF - Direct Plan - Growth,14.4636,2026-03-24
149335,INF966L01AN3,,Quant Value Fund - Growth Option  - Direct Plan,19.5468,2026-03-24
149339,INF754K01NS7,INF754K01NT5,Edelweiss NIFTY Large Midcap 250 Index Fund - Direct Plan Payout,15.5815,2026-03-24
149343,INF754K01NR9,,Edelweiss NIFTY Large Midcap 250 Index Fund - Direct Plan Growth,15.5814,2026-03-24
149345,INF200KA16B2,,SBI Fixed Maturity Plan (FMP) - Series 55 (1849 Days) - Direct Plan - Growth,13.0168,2026-03-24
149361,INF277KA1224,,Tata Corporate Bond Fund-Direct Plan-Growth,13.0353,2026-03-24
149368,INF179KC1BS5,,HDFC Multi Cap Fund - Growth Option - Direct Plan,17.816,2026-03-24
149373,INF846K013D2,,Axis Nifty 50 Index Fund - Direct Plan - Growth,13.8424,2026-03-24
149381,INF769K01HU3,,Mirae AssetHang Seng TECH ETF Fund of Fund Direct Plan - Growth Option,11.483,2026-03-24
149383,INF846K013E0,,Axis Multicap Fund - Direct Growth,17.2,2026-03-24
149389,INF109KC1W58,,ICICI Prudential Nifty Midcap 150 Index Fund - Direct Plan - Growth,17.8101,2026-03-24
149401,INF754K01NY5,,BHARAT Bond ETF FOF - April 2032 Direct Growth,12.9889,2026-03-24
149406,INF174V01BE0,,Mahindra Manulife Balanced Advantage Fund - Direct Plan - Growth,14.675,2026-03-24
149409,INF109KC17H6,,ICICI Prudential Overnight fund - Direct Plan - Unclaimed Redemption Stable Scheme,1000.0,2026-03-24
149410,INF109KC15H0,,ICICI Prudential Overnight fund - Direct Plan - Unclaimed Redemption Transitory Scheme,1279.159,2026-03-24
149431,INF200KA14C5,,SBI Fixed Maturity Plan (FMP) - Series 57 (1835 Days) - Direct Plan - Growth,12.9316,2026-03-24
149441,INF109KC1Y15,,ICICI Prudential Passive Multi-Asset Fund of Funds - Direct Plan - Growth,15.9246,2026-03-24
149447,INF959L01FR8,,Navi Nifty Next 50 Index Fund- Direct Plan- Growth,14.8256,2026-03-24
149450,INF0K1H01024,,Samco Flexi Cap Fund - Direct Plan - Growth Option,9.48,2026-03-24
149455,INF109KC1Z55,,ICICI Prudential Strategic Metal and Energy Equity Fund of Fund - Direct Plan Growth,30.5728,2026-03-24
149460,INF200KA18C6,,SBI Fixed Maturity Plan (FMP) - Series 58 (1842 Days) - Direct Plan - Growth,13.0449,2026-03-24
149466,INF846K019E7,,Axis Nifty Next 50 Index Fund - Direct Plan - Growth,15.432,2026-03-24
149474,INF200KA13D5,,SBI CPSE Bond Plus SDL Sep 2026 50:50 Index Fund - Direct Plan - Growth,12.8545,2026-03-24
149482,INF173K01EW1,INF173K01EX9,Sundaram Nifty 100 Equal Weight Fund (Formerly Known as Principal Nifty 100 Equal Weight Fund)- Direct Plan - Income Distribution CUM Capital Withdrawal Option,75.3746,2026-03-24
149483,INF173K01EZ4,,Sundaram Nifty 100 Equal Weight Fund (Formerly Known as Principal Nifty 100 Equal Weight Fund) - Direct Plan - Growth Option,171.5799,2026-03-24
149523,,INF173K01FR8,Sundaram Low Duration Fund (Formerly Known as Principal Low Duration Fund) - Direct Plan - Daily Income Distribution CUM Capital Withdrawal Option,1009.6449,2024-06-28
149524,INF903JA1KA2,INF173K01FW8,Sundaram Low Duration Fund (Formerly Known as Principal Low Duration Fund) - Direct Plan - Weekly Income Distribution CUM Capital Withdrawal Option,1006.3073,2024-06-28
149526,INF173K01FS6,,Sundaram Low Duration Fund (Formerly Known as Principal Low Duration Fund) - Direct Plan - Growth Option,3865.2183,2026-03-24
149533,INF173K01EK6,,Sundaram Focused Fund (Formerly Known as Principal Focused Multicap Fund)- Direct Plan - Growth Option,161.6743,2026-03-24
149539,INF173K01HI3,,Sundaram Ultra Short Duration Fund (Formerly Known as Principal Ultra Short Term Fund)- Direct Plan -Growth Option,3056.2827,2026-03-24
149549,INF173K01NC4,INF173K01NE0,Sundaram Arbitrage Fund( Formerly Known as Principal Arbitrage Fund) - Direct Plan- Monthly Income Distribution CUM Capital Withdrawal,13.8089,2026-03-24
149550,INF173K01NF7,,Sundaram Arbitrage Fund (Formerly Known as Prinicpal Arbitrage Fund) - Direct Plan - Growth,15.9703,2026-03-24
149570,INF173K01HZ7,,Sundaram ELSS Tax Saver Fund Direct Plan Growth,497.2661,2026-03-24
149587,INF173K01GP0,,Sundaram Short Duration Fund (Formerly Known as Principal Short Term Debt Fund)- Direct Plan - Growth Option,49.7401,2026-03-24
149601,INF173K01FE6,,Sundaram Aggressive Hybrid Fund (Formerly Known as Principal Hybrid Equity Fund)- Direct Plan - Growth Option,173.5268,2026-03-24
149602,INF173K01FB2,INF173K01FC0,Sundaram Aggressive Hybrid Fund(Formerly Known as Principal Hybrid Equity Fund)-Direct Plan - Monthly Income Distribution CUM Capital Withdrawal Option,37.6758,2026-03-24
149663,,INF173K01GT2,Sundaram Liquid Fund (Formerly Known as Principal Cash Management Fund )- Direct Plan - Income Distribution CUM Capital Withdrawal Option - Daily,1000.6367,2024-09-13
149664,INF173K01GU0,,Sundaram Liquid Fund (Formerly Known as Principal Cash Management Fund) - Direct Plan - Growth Option,2429.8183,2026-03-24
149665,,INF173K01GY2,Sundaram Liquid Fund(Formerly Known as Principal Cash Management Fund)- Direct Plan - Income Distribution CUM Capital Withdrawal Option - Weekly,1008.3385,2024-09-13
149669,INF173K01FQ0,,Sundaram Multi Cap Fund (Formerly Known as Principal Multi Cap Growth Fund)-Direct Plan - Growth Option,382.9998,2026-03-24
149679,INF173K01GZ9,,Sundaram Equity Savings Fund (Formerly Known as Principal Equity Savings Fund) - Direct Plan - Growth Option,80.2736,2026-03-24
149717,INF173K01FI7,,Sundaram Balanced Advantage Fund ( Formerly Known as Principal Balanced Advantage Fund) - Direct Plan - Growth Option,39.3859,2026-03-24
149718,INF173K01FF3,INF173K01FG1,Sundaram Balanced Advantage Fund (Formerly Known as Principal Balanced Advantage Fund) - Direct Plan - Monthly Income Distribution CUM Capital Withdrawal Option,17.1627,2026-03-24
149737,,INF903JA1JH9,Sundaram Liquid Fund (Formerly Known as Principal Cash Management Fund) Direct Principal Units,1280.5417,2025-06-27
149760,INF204KC1378,,Nippon India Silver ETF FOF- Direct Plan-Growth Option,33.8672,2026-03-24
149763,INF205KA1494,,Invesco India Flexi Cap Fund - Direct Plan - Growth,17.25,2026-03-24
149775,INF109KC1Y98,,ICICI Prudential Silver ETF FOF - Direct Plan - Growth,33.9269,2026-03-24
149780,INF209KB16F2,,Aditya Birla Sun Life Silver ETF FOF-Direct Growth,34.358,2026-03-24
149790,INF769K01HZ2,,Mirae Asset Nifty India Manufacturing ETF FOF - Direct Plan - Growth,18.265,2026-03-24
149794,INF209KB11F3,,Aditya Birla Sun Life Nifty SDL Apr 2027 Index Fund-Direct Growth,12.9929,2026-03-24
149797,INF0GCD01453,,TRUST MF OVERNIGHT FUND-DIRECT PLAN-GROWTH,1272.4243,2026-03-24
149800,INF247L01AV1,,Motilal Oswal Nifty 200 Momentum 30 Index Fund-Direct Plan,13.9576,2026-03-24
149803,INF789F1AVD7,,UTI BSE Sensex Index Fund - Direct Plan - Growth Option,13.3079,2026-03-24
149804,INF959L01FT4,,Navi Nifty Bank Index Fund- Direct Plan- Growth,13.8137,2026-03-24
149816,INF740KA1QP1,,DSP Global Innovation Overseas Equity Omni FoF - Direct - Growth,18.9314,2026-03-23
149822,INF200KA19D2,,SBI Fixed Maturity Plan (FMP) - Series 59 (1618 Days) - Direct Plan - Growth,12.8251,2026-03-24
149826,INF192K01MK9,,JM Overnight Fund - (Direct) - Unclaimed Redemption I.E.F. - Growth Plan,1073.9936,2026-03-24
149829,INF192K01MI3,,JM Overnight Fund - (Direct) - Unclaimed Redemption - Growth Plan,1363.8007,2026-03-24
149830,INF959L01FV0,,Navi Total Stock Market US Specific Equity Passive FoF- Direct Plan- Growth,19.2515,2026-03-24
149832,INF194KB1CR7,,BANDHAN NIFTY 100 INDEX FUND - DIRECT PLAN - GROWTH,14.0292,2026-03-24
149838,INF209KB10G3,,Aditya Birla Sun Life Nifty Next 50 Index Fund-Direct Growth,15.4691,2026-03-24
149841,INF174KA1IF4,,Kotak Manufacture in India Fund - Direct Plan Growth,19.677,2026-03-24
149847,INF846K011G9,,Axis Multi Factor Passive FoF - Direct Plan - Growth Option,14.4794,2026-03-24
149855,INF174KA1IL2,,Kotak Nifty SDL Apr  2027 Top 12 Equal Weight Index Fund-Direct Plan-Growth,12.9086,2026-03-24
149858,INF109KC11A4,,ICICI Prudential Nifty Bank Index Fund - Direct Plan Growth,15.1168,2026-03-24
149865,INF174KA1IR9,,Kotak Nifty SDL Apr 2032 Top 12 Equal Weight Index Fund-Direct Plan- Growth,13.1164,2026-03-24
149868,INF179KC1BY3,,HDFC NIFTY 100 Index Fund - Direct Plan - Growth Option,13.9569,2026-03-24
149870,INF179KC1CA1,,HDFC Nifty 100 Equal Weight Index Fund - Direct Plan - Growth Option,15.5034,2026-03-24
149873,INF846K017G6,,Axis CRISIL IBX SDL May 2027 Index Fund - Direct Plan - Growth,12.8752,2026-03-24
149878,INF200KA13E3,,SBI Fixed Maturity Plan (FMP) - Series 60 (1878 Days) - Direct Plan - Growth,12.956,2026-03-24
149881,INF789F1AVF2,,UTI BSE Low Volatility Index Fund - Direct Plan  - Growth Option,15.4443,2026-03-24
149882,INF200KA18E2,,SBI Multicap Fund- Direct Plan- Growth option,15.7895,2026-03-24
149892,INF959L01FX6,,Navi Nifty Midcap 150 Index Fund Direct Plan- Growth,18.8606,2026-03-24
149894,INF846K013H3,,Axis Nifty Smallcap 50 Index Fund - Direct Plan - Growth Option,16.158,2026-03-24
149910,INF959L01FZ1,,Navi NASDAQ100 US Specific Equity Passive FOF- Direct- Growth,20.1002,2026-03-24
149917,INF204KC1477,,Nippon India Fixed Maturity Plan-XLIII-Series 5- Direct Plan-Growth Option,13.2132,2026-03-24
149919,INF247L01AY5,,Motilal Oswal BSE Low Volatility Index Fund-Direct plan,15.3323,2026-03-24
149924,INF179KC1CC7,,HDFC FMP 1861D March 2022 - Growth Option - Direct Plan,13.0175,2026-03-24
149934,INF179KC1CI4,,HDFC FMP 1162D March 2022 - Growth Option - Direct Plan,12.0456,2025-05-19
149936,INF846K019H0,,Axis Nifty Midcap 50 Index Fund - Direct Plan - Growth Option,18.7407,2026-03-24
149950,INF754K01OG0,,Edelweiss CRISIL PSU Plus SDL 50:50 Oct 2025 Index Fund - Direct Plan Growth,12.3889,2025-10-31
149961,INF205KA1585,,Invesco India - Invesco EQQQ Nasdaq-100 ETF Fund of Fund - Direct Plan - Growth,21.1558,2026-03-24
149966,INF336L01QH7,,HSBC CRISIL IBX 50:50 Gilt Plus SDL Apr 2028 Index Fund - Direct - Growth,13.0168,2026-03-24
149970,INF740KA1QV9,,DSP Nifty SDL Plus G-Sec Jun 2028 30:70 Index Fund - Direct - Growth,13.0321,2026-03-24
149993,INF200KA13F0,,SBI Fixed Maturity Plan (FMP)- Series 61 (1927 Days)- Direct Plan- Growth option,12.9713,2026-03-24
149995,INF200KA14F8,,SBI Fixed Maturity Plan (FMP)- Series 61 (1927 Days)- Direct Plan- Income Distribution Cum Capital withdrawal option,12.9715,2026-03-24
149999,INF109KC14B6,,ICICI Prudential Nifty SDL Sep 2027 Index Fund - Direct Plan - Growth,12.9149,2026-03-24
150002,INF179KC1CO2,,HDFC FMP 1876D March 2022 - Growth Option - Direct Plan,12.9677,2026-03-24
150012,INF204KC1527,,Nippon India Nifty AAA CPSE Bond Plus SDL - Apr 2027 Maturity 60:40 Index Fund - Direct Plan - Growth Option,12.7638,2026-03-24
150159,INF251K01HF3,,BARODA BNP PARIBAS ELSS Tax Saver Fund - Direct Plan - Growth Option,101.6197,2026-03-24
150169,INF251K01GJ7,,BARODA BNP PARIBAS LOW DURATION Fund - Direct Plan - Growth Option,45.8094,2026-03-24
150180,INF251K01GW0,,Baroda BNP Paribas Dynamic Bond Fund - Direct Plan - Growth Option,51.0357,2026-03-24
150187,INF251K01HN7,,BARODA BNP PARIBAS LARGE CAP Fund - Direct Plan - Growth Option,237.5207,2026-03-24
150206,INF251K01HR8,,BARODA BNP PARIBAS Conservative Hybrid Fund - Direct Plan - Growth Option,54.8433,2026-03-24
150212,INF251K01HQ0,,BARODA BNP PARIBAS Mid Cap Fund - Direct Plan - Growth Option,116.6246,2026-03-24
150237,INF251K01GP4,,BARODA BNP PARIBAS Corporate Bond Fund - Direct Plan - Growth Option,30.2487,2026-03-24
150251,INF251K01OT0,,BARODA BNP PARIBAS ARBITRAGE FUND-DIRECT PLAN-GROWTH OPTION,17.7578,2026-03-24
150260,INF251K01OZ7,,Baroda BNP Paribas Aggressive Hybrid Fund- DIRECT PLAN - GROWTH OPTION,30.3437,2026-03-24
150264,INF251K01PN0,,BARODA BNP PARIBAS Focused Fund - Direct Plan - Growth Option,22.2877,2026-03-24
150266,INF251K01PT7,,BARODA BNP PARIBAS India Consumption Fund - Direct Plan - Growth Option,30.8343,2026-03-24
150285,INF251K01QT5,,Baroda BNP Paribas Aqua Fund of Fund - Direct Plan - Growth Option,15.3096,2026-03-24
150310,INF109KC10C2,,ICICI PRUDENTIAL HOUSING OPPORTUNITIES FUND - Direct Plan Growth,16.58,2026-03-24
150313,INF789F1AVH8,,UTI Nifty Midcap 150 Quality 50 Index Fund - Direct Plan - Growth Option,12.57,2026-03-24
150316,INF209KB14H3,,Aditya Birla Sun Life Fixed Term Plan - Series TQ (1879 days) - Direct Plan - Growth Option,12.9499,2026-03-24
150320,INF174KA1IW9,,Kotak FMP Series-294-105 days-Direct Plan- Growth,10.1214,2022-07-08
150326,INF277KA1372,,Tata Nifty SDL Plus AAA PSU Bond Dec 6040 Index Fund- Direct Plan-Growth,13.0058,2026-03-24
150344,INF277KA1430,,Tata Nifty India Digital ETF Fund of Fund-Direct Plan-Growth,12.2712,2026-03-24
150346,INF03VN01530,,WhiteOak Capital Flexi Cap Fund Direct Plan-Growth,16.508,2026-03-24
150353,INF209KB19H2,,Aditya Birla Sun Life Crisil IBX 60:40 SDL+AAA PSU-Apr 2027 Index Fund-Direct Growth,12.7941,2026-03-24
150358,INF769K01IH8,,Mirae Asset Nifty SDL Jun 2027 Index Fund -Direct Plan - Growth,12.8932,2026-03-24
150367,INF0J8L01065,,NJ Arbitrage Fund - Direct Plan - Growth Option,12.784,2026-03-24
150369,INF0J8L01081,,NJ Overnight Fund - Direct Plan - Growth Option,1245.132,2026-03-24
150376,INF754K01OP1,,Edelweiss Focused Fund - Direct Plan - Growth,16.087,2026-03-24
150379,INF200KA11M0,,SBI Fixed Maturity Plan (FMP) - Series 66 (1361 Days) - Direct Plan - Growth,12.8989,2026-03-24
150387,INF251K01QZ2,,Baroda BNP Paribas Flexi Cap Fund - Direct Plan - Growth Option,14.8658,2026-03-24
150390,INF082J01416,,Quantum Nifty 50 ETF Fund of Fund - Direct Plan - Growth,13.6195,2026-03-24
150392,INF767K01RE0,,LIC MF Money Market Fund-Direct Plan-Growth,1257.398,2026-03-24
150395,INF179KC1CU9,,HDFC FMP 1158D July 2022 - Growth Option - Direct Plan,12.4151,2025-09-25
150404,INF194KB1DJ2,,BANDHAN MIDCAP FUND - GROWTH - DIRECT PLAN,16.729,2026-03-24
150407,INF582M01HW2,,Union Gilt Fund - Direct Plan - Growth Option,12.0361,2026-03-24
150410,INF789F1AVR7,,UTI Gilt Fund with 10 year Constant Duration - Direct Plan - Growth Option,13.0164,2026-03-24
150428,INF740KA1RB9,,DSP Nifty Midcap 150 Quality 50 Index Fund - Direct - Growth,12.962,2026-03-24
150440,INF966L01AT0,,quant Large Cap Fund - Growth Option - Direct Plan,14.2093,2026-03-24
150443,INF247L01BC9,,Motilal Oswal BSE Financials ex Bank 30 Index Fund Direct Growth,15.9466,2026-03-24
150449,INF109KC17D5,,ICICI Prudential Fixed Maturity Plan - Series 88 - 226 Days Plan E - Direct Plan - Growth,10.3815,2023-03-09
150452,INF109KC11D8,,ICICI Prudential Nifty 200 Momentum 30 Index Fund - Direct Plan - Growth,15.2196,2026-03-24
150460,INF200KA15M1,,SBI Fixed Maturity Plan (FMP) - Series 67 (1467 Days) - Direct Plan - Growth,12.9037,2026-03-24
150468,INF109KC13E2,,ICICI Prudential Nifty IT Index Fund - Direct Plan - Growth,10.4611,2026-03-24
150470,INF769K01IN6,,Mirae Asset Balanced Advantage Fund Direct Plan- Growth,14.498,2026-03-24
150481,INF090I01WQ5,,Franklin India Balanced Advantage Fund- Growth- Direct,14.4698,2026-03-24
150484,INF209KB17J2,,Aditya Birla Sun Life Long Duration Fund-Direct Growth,12.9681,2026-03-24
150487,INF204KC1584,,Nippon India Nifty Alpha Low Volatility 30 Index Fund - Direct Plan - Growth Option,14.764,2026-03-24
150505,INF760K01KC4,,Canara Robeco Banking and PSU Debt Fund- Direct Plan- Growth Option,12.5312,2026-03-24
150513,INF0GCD01503,,TRUSTMF MONEY MARKET FUND-DIRECT PLAN-GROWTH,1278.7925,2026-03-24
150515,INF959L01GD6,,Navi Nifty India Manufacturing Index Fund- Direct Plan- Growth,17.3722,2026-03-24
150518,INF247L01BF2,,Motilal Oswal BSE Enhanced Value Index Fund-Direct plan,26.0815,2026-03-24
150521,INF247L01BI6,,Motilal Oswal BSE Quality Index Fund-Direct plan,15.8607,2026-03-24
150532,INF277KA1497,,Tata Housing Opportunities Fund - Direct Plan - Growth,13.8326,2026-03-24
150539,INF109KC12I5,,ICICI Prudential PSU Equity Fund - Direct Plan - Growth,21.86,2026-03-24
150545,INF192K01MP8,,JM Short Duration Fund (Direct) - Growth,12.7488,2026-03-24
150547,INF179KC1DC5,,HDFC FMP 1406D August 2022 - Growth Option - Direct Plan,12.8027,2026-03-24
150554,INF582M01IK5,,Union Retirement Fund - Direct Plan - Growth Option,15.42,2026-03-24
150562,INF680P01323,,Shriram Overnight Fund -  Direct Growth,12.4236,2026-03-24
150571,INF903JA1LE2,,Sundaram Flexicap Fund Direct Growth,14.1768,2026-03-24
150581,INF754K01OX5,,Edelweiss Gold and Silver ETF FOF - Direct Plan - Growth,32.264,2026-03-24
150584,INF03VN01597,,WhiteOak Capital Mid Cap Fund Direct Plan Growth,19.043,2026-03-24
150587,INF03VN01621,,WhiteOak Capital ELSS Tax Saver Fund Direct Plan Growth,16.468,2026-03-24
150591,INF194KB1DP9,,BANDHAN NIFTY200 MOMENTUM 30 INDEX FUND - GROWTH - DIRECT PLAN,14.2925,2026-03-24
150595,INF769K01IQ9,,Mirae Asset Global Electric & Autonomous Vehicles Equity Passive FOF - Direct Plan - Growth,14.895,2026-03-24
150597,INF769K01IS5,,Mirae Asset Global X Artificial Intelligence & Technology ETF Fund of Fund - Direct Plan- Growth,26.274,2026-03-24
150601,INF174KA1JI6,,Kotak FMP Series 296-Direct Plan-Growth,10.16263521,2022-11-29
150602,INF200KA17N5,,SBI Fixed Maturity Plan (FMP) - Series 64 (1169 Days) - Direct Plan - Growth,12.3372,2025-11-10
150615,INF846K015J4,,Axis Silver Fund of Fund- Direct Plan-Growth Option,37.9792,2026-03-24
150624,INF174KA1JN6,,Kotak Business Cycle - Direct Plan - Growth,15.423,2026-03-24
150627,INF204KC1634,,Nippon India Fixed Maturity Plan-XLIV-Series 1-Direct Plan-Growth Option,13.0423,2026-03-24
150631,INF0K1H01040,,Samco Overnight Fund - Direct Plan - Growth Option,1229.0457,2026-03-24
150636,INF194KB1DV7,,BANDHAN NIFTY100 LOW VOLATILITY 30 INDEX FUND - GROWTH - DIRECT PLAN,14.6468,2026-03-24
150639,INF109KC10J7,,ICICI Prudential Nifty50 Equal Weight Index Fund- Direct Plan - Growth,15.6536,2026-03-24
150642,INF247L01BM8,,Motilal Oswal Gold and Silver Passive Fund of Funds(Direct Plan),28.9532,2026-03-24
150643,INF109KC16J4,,ICICI Prudential Nifty Auto Index Fund - Direct Plan - Growth,19.6925,2026-03-24
150649,INF200KA15O7,,SBI Fixed Maturity Plan (FMP) - Series 68 (1302 Days) - Direct Plan - Growth,12.724,2026-03-24
150655,,,HDFC FMP 1359D September - Growth Option - Direct Plan,12.8136,2026-03-24
150659,INF767K01RK7,,LIC MF Multi Cap Fund-Direct Plan-Growth,16.3192,2026-03-24
150663,INF209KB10M1,,Aditya Birla Sun Life Nifty SDL Sep 2025 Index Fund-Direct Growth,12.2949,2025-09-30
150671,INF754K01PF9,,Edelweiss CRISIL IBX 50:50 Gilt Plus SDL April 2037 Index Fund - Direct Plan - Growth,13.0904,2026-03-24
150673,INF200KA10P5,,SBI Nifty Midcap 150 Index Fund - Direct Plan - Growth,17.3453,2026-03-24
150677,INF200KA16P2,,SBI Nifty Smallcap 250 Index Fund - Direct Plan - Growth,15.885,2026-03-24
150681,INF200KA12Q9,,SBI |CRISIL IBX Gilt Index - June 2036 Fund - Direct Plan - Growth,13.173,2026-03-24
150685,INF109KC12K1,,ICICI PRUDENTIAL TRANSPORTATION AND LOGISTICS FUND - Direct Plan - Growth,19.18,2026-03-24
150688,INF209KB15M0,,Aditya Birla Sun Life Multi-Asset Passive FOF-Direct Growth,16.0221,2026-03-24
150692,INF277KA1554,,TATA CRISIL-IBX GILT INDEX - APRIL 2026 INDEX FUND - DIRECT PLAN - GROWTH,12.6722,2026-02-13
150698,INF209KB10N9,,Aditya Birla Sun Life Crisil IBX Gilt-April 2026 Index Fund-Direct Growth,12.7169,2026-03-24
150702,INF209KB14N1,,Aditya Birla Sun Life Crisil IBX 50:50 Gilt Plus SDL Apr 2028 Index Fund-Direct Growth,13.0271,2026-03-24
150706,INF200KA18Q6,,SBI CRISIL IBX Gilt Index - April 2029 Fund - Direct Plan - Growth,13.0622,2026-03-24
150711,INF200KA14R3,,SBI CRISIL IBX SDL Index - September 2027 Fund - Direct Plan - Growth,12.9145,2026-03-24
150714,INF789F1AWB9,,UTI Gold ETF Fund of Fund - Direct Plan - Growth Option,26.7626,2026-03-24
150716,INF194KB1EB7,,BANDHAN TRANSPORTATION AND LOGISTICS FUND - GROWTH - DIRECT PLAN,18.423,2026-03-24
150725,INF174KA1JT3,,Kotak Nifty SDL Plus AAA PSU Bond Jul 2028 60:40 Index Fund Direct Plan - Growth,12.923,2026-03-24
150727,INF754K01PN3,,Edelweiss CRISIL IBX 50:50 Gilt Plus SDL June 2027 Index Fund - Direct Plan - Growth,12.9044,2026-03-24
150729,INF109KC14L5,,ICICI Prudential Nifty SDL Dec 2028 Index Fund - Direct Plan - Growth,13.1034,2026-03-24
150733,INF109KC18K8,,ICICI Prudential Nifty G-Sec Dec 2030 Index Fund - Direct Plan - Growth,13.0511,2026-03-24
150737,INF179KC1DU7,,HDFC Silver ETF Fund of Fund - Growth Option - Direct Plan,36.774,2026-03-24
150738,INF277KA1612,,Tata Nifty Midcap 150 Momentum 50 Index Fund - Growth - Direct Plan,16.5021,2026-03-24
150746,INF194KB1EH4,,BANDHAN CRISIL IBX GILT APRIL 2026 INDEX FUND - DIRECT PLAN - GROWTH,12.6989,2026-03-24
150751,INF846K012K9,,Axis NASDAQ 100 US Specific Equity Passive FOF - Direct Plan - Growth,24.0524,2026-03-24
150754,INF204KC1683,,Nippon India Nifty AAA PSU Bond Plus SDL - Sep 2026 Maturity 50:50 Index Fund-Direct Plan-Growth Option,12.74,2026-03-24
150778,INF209KB12O3,,Aditya Birla Sun Life Crisil IBX Gilt-Apr-2029 Index Fund-Direct Growth,13.1106,2026-03-24
150783,INF174KA1KE3,,Kotak FMP Series 297-Direct Plan-Growth,10.30571469,2023-03-20
150788,INF769K01JD5,,Mirae Asset Nifty AAA PSU Bond Plus SDL Apr 2026 50:50 Index Fund - Direct Plan - Growth,12.7234,2026-03-24
150792,INF769K01IX5,,Mirae Asset CRISIL IBX Gilt Index - April 2033 Index Fund - Direct Plan - Growth,13.1178,2026-03-24
150797,INF03VN01696,,WhiteOak Capital Large Cap Fund Direct Plan Growth,14.411,2026-03-24
150805,INF179KC1DY9,,HDFC Business Cycle Fund - Growth Option - Direct Plan,13.413,2026-03-24
150807,INF754K01PV6,,Edelweiss CRISIL IBX 50:50 Gilt Plus SDL Sep 2028 Index Fund - Direct Plan - Growth,12.9587,2026-03-24
150815,INF192K01MV6,,JM Midcap Fund (Direct) - Growth,18.1097,2026-03-24
150817,INF760K01KI1,,Canara Robeco Mid Cap Fund- Direct Plan- Growth Option,16.36,2026-03-24
150822,INF174KA1KJ2,,Kotak Income Plus Arbitrage Omni FOF-Direct Plan-Growth,12.8472,2026-03-24
150824,INF204KC1741,,Nippon India Nifty SDL Plus G-Sec - Jun 2028 Maturity 70:30 Index Fund-Direct Plan-Growth Option,12.8185,2026-03-24
150833,INF789F1AWK0,,UTI Fixed Term Income Fund - Series XXXV-I (1260 Days) - Direct Plan - Growth Option,12.6696,2026-03-24
150838,INF0K1H01065,,Samco ELSS Tax Saver Fund - Direct Plan - Growth Option,11.73,2026-03-24
150842,INF740KA1RI4,,DSP FMP Series - 267 - 1246 Days - Direct - Growth,12.6691,2026-03-24
150845,INF179KC1EE9,,HDFC Nifty G-Sec Dec 2026 Index Fund - Growth Option - Direct Plan,12.7169,2026-03-24
150847,INF179KC1EH2,,HDFC Nifty G-Sec July 2031 Index Fund - Growth Option - Direct Plan,12.9464,2026-03-24
150854,INF846K018K6,,Axis Nifty SDL September 2026 Debt Index Fund - Direct Plan - Growth,12.6961,2026-03-24
150858,INF582M01IO7,,Union Multicap Fund - Direct Plan - Growth Option,15.32,2026-03-24
150865,INF251K01RF2,,Baroda BNP Paribas Multi Asset Fund - Direct Plan - Growth Option,15.7469,2026-03-24
150868,INF194KB1ET9,,BANDHAN CRISIL IBX 90:10 SDL PLUS GILT - NOV 2026 INDEX FUND - DIRECT GROWTH,12.7377,2026-03-24
150871,INF194KB1EN2,,BANDHAN CRISIL IBX 90:10 SDL PLUS GILT APRIL 2032 INDEX FUND - DIRECT GROWTH,12.8407,2026-03-24
150885,INF740KA1RO2,,DSP FMP Series - 268 - 1281 Days - Direct - Growth,12.649,2026-03-24
150888,INF194KB1EZ6,,BANDHAN CRISIL IBX 90:10 SDL PLUS GILT - SEP27 INDEX FUND - DIRECT GROWTH,12.8044,2026-03-24
150892,INF754K01QT8,,Edelweiss Nifty Smallcap 250 Index Fund - Direct Plan - Growth,15.1633,2026-03-24
150899,INF754K01QL5,,Edelweiss Nifty Next 50 Index Fund - Direct Plan - Growth,14.5091,2026-03-24
150902,INF754K01QD2,,Edelweiss Nifty Midcap150 Momentum 50 Index Fund - Direct Plan - Growth,16.5266,2026-03-24
150906,INF204KC1881,,Nippon India Nifty G-Sec Sep 2027 Maturity Index Fund-Direct Plan-Growth Option,12.6579,2026-03-24
150915,INF174V01BK7,,Mahindra Manulife Small Cap Fund - Direct Plan - Growth,18.3073,2026-03-24
150916,INF200KA18S2,,SBI Fixed Maturity Plan (FMP)-Series 72 (1239 Days) Direct Plan- Income Distribution Cum Capital Withdrawal Payout,12.5914,2026-03-24
150919,INF200KA17S4,,SBI Fixed Maturity Plan (FMP)-Series 72 (1239 Days) Direct Plan- Growth,12.5914,2026-03-24
150920,INF204KC1AC0,,Nippon India Nifty G-Sec Jun 2036 Maturity Index Fund-Direct Plan-Growth Option,12.897,2026-03-24
150930,INF109KC11M9,,ICICI Prudential Nifty Pharma Index Fund - Direct Plan - Growth,17.2039,2026-03-24
150932,INF204KC1931,,Nippon India Fixed Maturity Plan - XLIV - Series 4-Direct Plan-Growth Option,12.5363,2026-03-24
150938,INF209KB10P4,,Aditya Birla Sun Life Crisil IBX 60:40 SDL + AAA PSU APR 2026 Index Fund-Direct Growth,12.5286,2026-03-24
150947,INF174KA1KS3,,Kotak FMP Series 299 - Direct Plan - Growth,10.21490534,2023-03-13
150950,INF109KC17M6,,ICICI Prudential Fixed Maturity Plan - Series 88 - 1226 Days Plan F - Direct Plan - Growth,12.5519,2026-03-24
150955,INF109KC12N5,,ICICI Prudential Fixed Maturity Plan - Series 88 - 91 Days Plan G - Direct Plan - Growth,10.1718,2023-03-13
150963,INF789F1AWU9,,UTI Fixed Term Income Fund - Series XXXV-II (1223 Days) - Direct Plan - Growth Option,12.5406,2026-03-24
150984,INF200KA11T5,,SBI Fixed Maturity Plan (FMP) - Series 73 (1226 Days) - Direct Plan - Growth,12.5583,2026-03-24
150989,INF754K01RC2,,BHARAT Bond ETF FOF - April 2033 - Direct Plan - Growth,12.6506,2026-03-24
150996,INF917K01HN3,,HSBC Corporate Bond Fund - Direct Growth,80.7053,2026-03-24
151014,INF917K01FI7,,HSBC Gilt Fund - Direct Growth,75.1822,2026-03-24
151036,INF917K01FZ1,,HSBC Midcap Fund - Direct Growth,421.1929,2026-03-24
151040,INF917K01FW8,,HSBC Infrastructure Fund - Direct Growth,49.003,2026-03-24
