scheme_code,isin_growth,isin_div_reinv,scheme_name
148737,INF336L01PV0,,HSBC Global Equity Climate Change Fund of Fund - Direct - Growth
148745,INF174KA1GA9,,Kotak Nifty Next 50 Index Fund - Direct Plan - Growth Option
148746,INF174KA1FZ8,INF174KA1GB7,Kotak Nifty Next 50 Index Fund - Direct Plan -Payout of Income Distribution cum capital withdrawal option
148747,INF247L01AL2,,Motilal Oswal Asset Allocation FOF- A- Direct Growth
148750,INF247L01AN8,,Motilal Oswal Asset Allocation FOF- C- Direct Growth
148751,INF205KA1338,,Invesco India ESG Integration Strategy Fund - Direct Plan - Growth
148755,INF769K01HD9,,Mirae Asset Corporate Bond Fund Direct Growth Plan
148760,INF200KA1U28,,SBI US Specific Equity Active FoF - Direct Plan - Growth
148771,INF740KA1PV1,,DSP Floater Fund - Direct Plan - Growth
148789,INF194KB1BP3,,BANDHAN CRISIL IBX Gilt June 2027 Index Fund Direct Plan-Growth
148792,INF194KB1BV1,,BANDHAN CRISIL IBX Gilt April 2028 Index Fund Direct Plan-Growth
148795,INF754K01MD1,,Edelweiss NIFTY PSU Bond Plus SDL Apr 2026 50:50 Index Fund - Direct Plan - Growth
148807,INF209KB1W74,,Aditya Birla Sun Life Nifty Midcap 150 Index Fund-Direct Growth
148815,INF209KB1W17,,Aditya Birla Sun Life Nifty Smallcap 50 Index Fund-Direct Growth
148822,INF109KC1P81,,ICICI Prudential Nifty 100 Low Volatility 30 ETF FOF - Direct Plan - Growth
148837,INF0GCD01271,INF0GCD01289,TRUSTMF Liquid Fund-Direct Plan-Weekly Income Distribution cum Capital Withdrawal
148839,INF0GCD01305,INF0GCD01297,TRUSTMF Liquid Fund-Direct Plan-Monthly Income Distribution cum Capital Withdrawal
148841,INF0GCD01255,,TRUSTMF Liquid Fund-Direct Plan-Growth
148842,,INF0GCD01263,TRUSTMF Liquid Fund-Direct Plan-Daily Income Distribution cum Capital Withdrawal
148846,INF200KA1V19,,SBI Fixed Maturity Plan (FMP) Series 42 (1857 Days) - Direct Plan - Growth
148883,INF760K01JQ6,,Canara Robeco Focused Fund - Direct Plan - Growth Option
148903,INF179KC1BA3,,HDFC Multi-Asset Active FOF - Growth Option -Direct Plan
148913,INF00XX01AE2,,ITI Ultra Short Duration Fund - Direct Plan - Growth Option
148921,INF209KB1Y49,,Aditya Birla Sun Life Multi-Cap Fund-Direct Growth
148925,INF966L01AK9,,quant Quantamental Fund - Growth Option - Direct Plan
148928,INF769K01HH0,,Mirae Asset NYSE FANG + ETF Fund of Fund Direct Growth
148945,INF200KA1W00,,SBI Nifty Next 50 Index Fund - Direct Plan - Growth
148954,INF846K01Z20,,Axis Global Innovation Fund of Fund - Direct Plan - Growth
148958,INF879O01175,,Parag Parikh Conservative Hybrid Fund - Direct Plan - Growth
148962,INF209KB1Z71,,Aditya Birla Sun Life Nifty 50 Equal Weight Index Fund-Direct Growth
148967,INF200KA1W59,,SBI Fixed Maturity Plan (FMP) - Series 44 (1855 Days) - Direct Plan - Growth
148972,INF00XX01AQ6,,ITI Value Fund - Direct Plan - Growth Option
148978,INF174KA1HA7,,Kotak Nifty 50 Index Fund - Direct Plan-Growth
148980,INF761K01FL3,,BANK OF INDIA Large Cap Fund Direct Plan Growth
148986,INF179KC1BG0,,HDFC Banking & Financial Services Fund - Growth Option - Direct Plan
148990,INF109KC1R14,,ICICI Prudential Flexicap Fund - Direct Plan - Growth
148993,INF846K01Z87,,Axis Quant Fund - Direct Plan - Growth
148999,INF200KA1W91,,SBI Fixed Maturity Plan (FMP) Series 45 (1840 Days) - Direct Plan - Growth
149007,INF277KA1026,,Tata Floating Rate Fund -Direct Plan-Growth
149011,INF205KA1429,,Invesco India Medium Duration Fund - Direct Plan - Growth
149017,INF209KB12A2,,Aditya Birla Sun Life Fixed Term Plan - Series TI (1837 days) - Direct Plan - Growth Option
149019,INF663L01W06,,PGIM India Small Cap Fund - Direct Plan- Growth Option
149029,INF00XX01BC4,,ITI Dynamic Bond Fund - Direct Plan - Growth Option
149039,INF959L01FP2,,Navi Nifty 50 Index Fund-Direct Plan-Growth
149043,INF200KA1X41,,SBI Fixed Maturity Plan (FMP) - Series 46 (1850 Days) - Direct Plan - Growth
149049,INF846K014A6,,Axis Floater Fund - Direct Plan - Growth
149059,INF174KA1HG4,,Kotak Global Innovation Overseas Equity Omni FOF- Direct Plan -Growth
149062,INF209KB16A3,,Aditya Birla Sun Life Fixed Term Plan - Series TJ (1838 days) - Direct Plan - Growth Option
149071,INF277KA1166,,Tata Business Cycle Fund-Direct Plan-Growth
149076,INF0GCD01370,,TRUSTMF Short Duration Fund-Direct Plan-Growth
149077,,INF0GCD01388,TRUSTMF Short Duration Fund-Direct Plan-Weekly Income Distribution Cum Capital Withdrawal
149078,INF0GCD01396,INF0GCD01404,TRUSTMF Short Duration Fund-Direct Plan-Monthly Income Distribution Cum Capital Withdrawal
149079,INF0GCD01412,INF0GCD01420,TRUSTMF Short Duration Fund-Direct Plan-Quarterly Income Distribution Cum Capital Withdrawal
149085,INF760K01JW4,,Canara Robeco Value Fund - Direct Plan - Growth Option
149091,INF789F1AVA3,,UTI Focused Fund - Direct Plan - Growth Option
149094,INF204KC1121,,Nippon India Flexi Cap Fund - Direct Plan - Growth Plan - Growth Option
149098,INF194KB1CF2,,Bandhan US specific Equity Active FOF - GROWTH - DIRECT PLAN
149104,INF174V01AS2,,Mahindra Manulife Flexi Cap Fund - Direct Plan -Growth
149107,INF179KC1BM8,,HDFC NIFTY50 Equal weight Index Fund - Direct Plan - Growth Option
149112,INF769K01HN8,,Mirae Asset Money Market Fund Direct Growth
149117,INF582M01HG5,,Union Money Market Fund - Direct Plan -  Growth Option
149129,INF204KC1170,,Nippon India Fixed Maturity Plan - XLIII - Series 1- Direct Plan - Growth Option
149130,INF204KC1188,,Nippon India Fixed Maturity Plan - XLIII - Series 1 - Direct Plan - Income Distribution Cum Capital Withdrawal Plan
149134,INF200KA1Y73,,SBI Balanced Advantage Fund - Direct Plan - Growth
149139,INF174KA1HM2,,Kotak FMP Series 292 - Direct Plan - Growth
149141,INF955L01KK1,,Baroda BNP Paribas Business Cycle Fund - Direct Plan - Growth
149147,INF200KA1Z23,,SBI Fixed Maturity Plan (FMP) - Series 49 (1823 Days) - Direct Plan - Growth
149158,INF109KC1R89,,ICICI Prudential Nifty Alpha Low - Volatility 30 ETF FOF - Direct Plan - Growth
149166,INF846K010C0,,Axis Value Fund - Direct Plan - Growth
149170,INF769K01HR9,,Mirae Asset S&P 500 Top 50 ETF Fund of Fund Direct Growth
149174,INF200KA1Z64,,SBI Fixed Maturity Plan (FMP) - Series 50 (1843 Days) - Direct Plan - Growth
149180,INF179KC1BO4,,HDFC Developed World Overseas Equity Passive FOF - Direct Plan - Growth Option
149185,INF174KA1HV3,,Kotak Multicap Fund-Direct Plan-Growth
149190,INF740KA1QH8,,DSP FMP Series - 264 - 60M - 17D - Direct - Growth
149195,INF200KA10A7,,SBI Fixed Maturity Plan (FMP) - Series 51 (1846 Days) - Direct Plan - Growth
149199,INF209KB18B7,,Aditya Birla Sun Life Nifty SDL Plus PSU Bond SEP 2026 60:40 Index Fund-Direct Growth
149210,INF109KC1S88,,ICICI Prudential Nifty PSU Bond Plus SDL Sep 2027 40:60 Index Fund - Direct Plan Growth
149219,INF109KC1U50,,ICICI Prudential NASDAQ 100 Index Fund - Direct Plan - Growth
149230,INF174V01AY0,,Mahindra Manulife Asia Pacific REITs FOF - Direct Plan - Growth
149232,INF200KA14A9,,SBI Fixed Maturity Plan (FMP) - Series 52 (1848 Days) - Direct Plan - Growth
149240,INF247L01AQ1,,Motilal Oswal 5 Year G-Sec Fund Of Fund Direct -Growth
149243,INF846K017C5,,Axis Nifty AAA Bond Plus SDL Apr 2026 50:50 ETF FOF - Direct Plan - Growth Option
149247,INF754K01MT7,,Edelweiss NIFTY PSU Bond Plus SDL Apr 2027 50:50 Index Fund - Direct Plan Growth
149250,INF754K01NB3,,Edelweiss Nifty 50 Index Fund Direct Plan Growth
149254,INF754K01NJ6,,Edelweiss Nifty 100 Quality 30 Index Fund Direct Plan Growth
149261,INF767K01QY0,,LIC MF Balanced Advantage Fund-Direct Plan-Growth
149264,INF0J8L01040,,NJ Balanced Advantage Fund - Direct Plan - Growth Option
149268,INF00XX01BO9,,ITI Pharma and Healthcare Fund - Direct Plan - Growth Option
149279,INF200KA18A0,,SBI Fixed Maturity Plan (FMP) - Series 53 (1839 Days) - Direct Plan - Growth
149283,INF109KC1V18,,ICICI Prudential Nifty Smallcap 250 Index Fund - Direct Plan - Growth
149288,INF179KC1BQ9,,HDFC NIFTY Next 50 Index Fund - Direct Plan - Growth Option
149291,INF209KB18C5,,Aditya Birla Sun Life US Equity Passive FOF-Direct-Growth
149295,INF209KB14D2,,Aditya Birla Sun Life Business Cycle Fund-Direct Growth
149298,INF663L01W63,,PGIM India Global Select Real Estate Securities Fund of Fund - Direct Plan - Growth Option
149303,INF194KB1CL0,,BANDHAN MULTI CAP FUND - GROWTH - DIRECT PLAN
149307,INF200KA12B1,,SBI Fixed Maturity Plan (FMP) - Series 54 (1842 Days) - Direct Plan - Growth
149318,INF579M01AI2,,360 ONE QUANT FUND DIRECT GROWTH
149319,INF579M01AJ0,INF579M01AK8,360 ONE QUANT FUND DIRECT INCOME DISTRIBUTION CUM CAPITAL WITHDRAWAL
149321,INF00XX01BU6,,ITI Banking and Financial Services Fund - Direct Plan - Growth Option
149329,INF204KC1303,,Nippon India Taiwan Equity Fund- Direct Plan- Growth Option
149331,INF109KC1V91,,ICICI Prudential BSE 500 ETF FOF - Direct Plan - Growth
149335,INF966L01AN3,,Quant Value Fund - Growth Option  - Direct Plan
149339,INF754K01NS7,INF754K01NT5,Edelweiss NIFTY Large Midcap 250 Index Fund - Direct Plan Payout
149343,INF754K01NR9,,Edelweiss NIFTY Large Midcap 250 Index Fund - Direct Plan Growth
149345,INF200KA16B2,,SBI Fixed Maturity Plan (FMP) - Series 55 (1849 Days) - Direct Plan - Growth
149361,INF277KA1224,,Tata Corporate Bond Fund-Direct Plan-Growth
149368,INF179KC1BS5,,HDFC Multi Cap Fund - Growth Option - Direct Plan
149373,INF846K013D2,,Axis Nifty 50 Index Fund - Direct Plan - Growth
149381,INF769K01HU3,,Mirae AssetHang Seng TECH ETF Fund of Fund Direct Plan - Growth Option
149383,INF846K013E0,,Axis Multicap Fund - Direct Growth
149389,INF109KC1W58,,ICICI Prudential Nifty Midcap 150 Index Fund - Direct Plan - Growth
149401,INF754K01NY5,,BHARAT Bond ETF FOF - April 2032 Direct Growth
149406,INF174V01BE0,,Mahindra Manulife Balanced Advantage Fund - Direct Plan - Growth
149409,INF109KC17H6,,ICICI Prudential Overnight fund - Direct Plan - Unclaimed Redemption Stable Scheme
149410,INF109KC15H0,,ICICI Prudential Overnight fund - Direct Plan - Unclaimed Redemption Transitory Scheme
149431,INF200KA14C5,,SBI Fixed Maturity Plan (FMP) - Series 57 (1835 Days) - Direct Plan - Growth
149441,INF109KC1Y15,,ICICI Prudential Passive Multi-Asset Fund of Funds - Direct Plan - Growth
149447,INF959L01FR8,,Navi Nifty Next 50 Index Fund- Direct Plan- Growth
149450,INF0K1H01024,,Samco Flexi Cap Fund - Direct Plan - Growth Option
149455,INF109KC1Z55,,ICICI Prudential Strategic Metal and Energy Equity Fund of Fund - Direct Plan Growth
149460,INF200KA18C6,,SBI Fixed Maturity Plan (FMP) - Series 58 (1842 Days) - Direct Plan - Growth
149466,INF846K019E7,,Axis Nifty Next 50 Index Fund - Direct Plan - Growth
149474,INF200KA13D5,,SBI CPSE Bond Plus SDL Sep 2026 50:50 Index Fund - Direct Plan - Growth
149482,INF173K01EW1,INF173K01EX9,Sundaram Nifty 100 Equal Weight Fund (Formerly Known as Principal Nifty 100 Equal Weight Fund)- Direct Plan - Income Distribution CUM Capital Withdrawal Option
149483,INF173K01EZ4,,Sundaram Nifty 100 Equal Weight Fund (Formerly Known as Principal Nifty 100 Equal Weight Fund) - Direct Plan - Growth Option
149523,,INF173K01FR8,Sundaram Low Duration Fund (Formerly Known as Principal Low Duration Fund) - Direct Plan - Daily Income Distribution CUM Capital Withdrawal Option
149524,INF903JA1KA2,INF173K01FW8,Sundaram Low Duration Fund (Formerly Known as Principal Low Duration Fund) - Direct Plan - Weekly Income Distribution CUM Capital Withdrawal Option
149526,INF173K01FS6,,Sundaram Low Duration Fund (Formerly Known as Principal Low Duration Fund) - Direct Plan - Growth Option
149533,INF173K01EK6,,Sundaram Focused Fund (Formerly Known as Principal Focused Multicap Fund)- Direct Plan - Growth Option
149539,INF173K01HI3,,Sundaram Ultra Short Duration Fund (Formerly Known as Principal Ultra Short Term Fund)- Direct Plan -Growth Option
149549,INF173K01NC4,INF173K01NE0,Sundaram Arbitrage Fund( Formerly Known as Principal Arbitrage Fund) - Direct Plan- Monthly Income Distribution CUM Capital Withdrawal
149550,INF173K01NF7,,Sundaram Arbitrage Fund (Formerly Known as Prinicpal Arbitrage Fund) - Direct Plan - Growth
149570,INF173K01HZ7,,Sundaram ELSS Tax Saver Fund Direct Plan Growth
149587,INF173K01GP0,,Sundaram Short Duration Fund (Formerly Known as Principal Short Term Debt Fund)- Direct Plan - Growth Option
149601,INF173K01FE6,,Sundaram Aggressive Hybrid Fund (Formerly Known as Principal Hybrid Equity Fund)- Direct Plan - Growth Option
149602,INF173K01FB2,INF173K01FC0,Sundaram Aggressive Hybrid Fund(Formerly Known as Principal Hybrid Equity Fund)-Direct Plan - Monthly Income Distribution CUM Capital Withdrawal Option
149663,,INF173K01GT2,Sundaram Liquid Fund (Formerly Known as Principal Cash Management Fund )- Direct Plan - Income Distribution CUM Capital Withdrawal Option - Daily
149664,INF173K01GU0,,Sundaram Liquid Fund (Formerly Known as Principal Cash Management Fund) - Direct Plan - Growth Option
149665,,INF173K01GY2,Sundaram Liquid Fund(Formerly Known as Principal Cash Management Fund)- Direct Plan - Income Distribution CUM Capital Withdrawal Option - Weekly
149669,INF173K01FQ0,,Sundaram Multi Cap Fund (Formerly Known as Principal Multi Cap Growth Fund)-Direct Plan - Growth Option
149679,INF173K01GZ9,,Sundaram Equity Savings Fund (Formerly Known as Principal Equity Savings Fund) - Direct Plan - Growth Option
149717,INF173K01FI7,,Sundaram Balanced Advantage Fund ( Formerly Known as Principal Balanced Advantage Fund) - Direct Plan - Growth Option
149718,INF173K01FF3,INF173K01FG1,Sundaram Balanced Advantage Fund (Formerly Known as Principal Balanced Advantage Fund) - Direct Plan - Monthly Income Distribution CUM Capital Withdrawal Option
149737,,INF903JA1JH9,Sundaram Liquid Fund (Formerly Known as Principal Cash Management Fund) Direct Principal Units
149760,INF204KC1378,,Nippon India Silver ETF FOF- Direct Plan-Growth Option
149763,INF205KA1494,,Invesco India Flexi Cap Fund - Direct Plan - Growth
149775,INF109KC1Y98,,ICICI Prudential Silver ETF FOF - Direct Plan - Growth
149780,INF209KB16F2,,Aditya Birla Sun Life Silver ETF FOF-Direct Growth
149790,INF769K01HZ2,,Mirae Asset Nifty India Manufacturing ETF FOF - Direct Plan - Growth
149794,INF209KB11F3,,Aditya Birla Sun Life Nifty SDL Apr 2027 Index Fund-Direct Growth
149797,INF0GCD01453,,TRUST MF OVERNIGHT FUND-DIRECT PLAN-GROWTH
149800,INF247L01AV1,,Motilal Oswal Nifty 200 Momentum 30 Index Fund-Direct Plan
149803,INF789F1AVD7,,UTI BSE Sensex Index Fund - Direct Plan - Growth Option
149804,INF959L01FT4,,Navi Nifty Bank Index Fund- Direct Plan- Growth
149816,INF740KA1QP1,,DSP Global Innovation Overseas Equity Omni FoF - Direct - Growth
149822,INF200KA19D2,,SBI Fixed Maturity Plan (FMP) - Series 59 (1618 Days) - Direct Plan - Growth
149826,,,JM Overnight Fund - (Direct) - Unclaimed Redemption I.E.F. - Growth Plan
149829,,,JM Overnight Fund - (Direct) - Unclaimed Redemption - Growth Plan
149830,INF959L01FV0,,Navi Total Stock Market US Specific Equity Passive FoF- Direct Plan- Growth
149832,INF194KB1CR7,,BANDHAN NIFTY 100 INDEX FUND - DIRECT PLAN - GROWTH
149838,INF209KB10G3,,Aditya Birla Sun Life Nifty Next 50 Index Fund-Direct Growth
149841,INF174KA1IF4,,Kotak Manufacture in India Fund - Direct Plan Growth
149847,INF846K011G9,,Axis Multi Factor Passive FoF - Direct Plan - Growth Option
149855,INF174KA1IL2,,Kotak Nifty SDL Apr  2027 Top 12 Equal Weight Index Fund-Direct Plan-Growth
149858,INF109KC11A4,,ICICI Prudential Nifty Bank Index Fund - Direct Plan Growth
149865,INF174KA1IR9,,Kotak Nifty SDL Apr 2032 Top 12 Equal Weight Index Fund-Direct Plan- Growth
149868,INF179KC1BY3,,HDFC NIFTY 100 Index Fund - Direct Plan - Growth Option
149870,INF179KC1CA1,,HDFC Nifty 100 Equal Weight Index Fund - Direct Plan - Growth Option
149873,INF846K017G6,,Axis CRISIL IBX SDL May 2027 Index Fund - Direct Plan - Growth
149878,INF200KA13E3,,SBI Fixed Maturity Plan (FMP) - Series 60 (1878 Days) - Direct Plan - Growth
149881,INF789F1AVF2,,UTI BSE Low Volatility Index Fund - Direct Plan  - Growth Option
149882,INF200KA18E2,,SBI Multicap Fund- Direct Plan- Growth option
149892,INF959L01FX6,,Navi Nifty Midcap 150 Index Fund Direct Plan- Growth
149894,INF846K013H3,,Axis Nifty Smallcap 50 Index Fund - Direct Plan - Growth Option
149910,INF959L01FZ1,,Navi NASDAQ100 US Specific Equity Passive FOF- Direct- Growth
149917,INF204KC1477,,Nippon India Fixed Maturity Plan-XLIII-Series 5- Direct Plan-Growth Option
149919,INF247L01AY5,,Motilal Oswal BSE Low Volatility Index Fund-Direct plan
149924,INF179KC1CC7,,HDFC FMP 1861D March 2022 - Growth Option - Direct Plan
149934,INF179KC1CI4,,HDFC FMP 1162D March 2022 - Growth Option - Direct Plan
149936,INF846K019H0,,Axis Nifty Midcap 50 Index Fund - Direct Plan - Growth Option
149950,INF754K01OG0,,Edelweiss CRISIL PSU Plus SDL 50:50 Oct 2025 Index Fund - Direct Plan Growth
149961,INF205KA1585,,Invesco India - Invesco EQQQ Nasdaq-100 ETF Fund of Fund - Direct Plan - Growth
149966,INF336L01QH7,,HSBC CRISIL IBX 50:50 Gilt Plus SDL Apr 2028 Index Fund - Direct - Growth
149970,INF740KA1QV9,,DSP Nifty SDL Plus G-Sec Jun 2028 30:70 Index Fund - Direct - Growth
149993,INF200KA13F0,,SBI Fixed Maturity Plan (FMP)- Series 61 (1927 Days)- Direct Plan- Growth option
149995,INF200KA14F8,,SBI Fixed Maturity Plan (FMP)- Series 61 (1927 Days)- Direct Plan- Income Distribution Cum Capital withdrawal option
149999,INF109KC14B6,,ICICI Prudential Nifty SDL Sep 2027 Index Fund - Direct Plan - Growth
150002,INF179KC1CO2,,HDFC FMP 1876D March 2022 - Growth Option - Direct Plan
150012,INF204KC1527,,Nippon India Nifty AAA CPSE Bond Plus SDL - Apr 2027 Maturity 60:40 Index Fund - Direct Plan - Growth Option
150159,INF251K01HF3,,BARODA BNP PARIBAS ELSS Tax Saver Fund - Direct Plan - Growth Option
150169,INF251K01GJ7,,BARODA BNP PARIBAS LOW DURATION Fund - Direct Plan - Growth Option
150180,INF251K01GW0,,Baroda BNP Paribas Dynamic Bond Fund - Direct Plan - Growth Option
150187,INF251K01HN7,,BARODA BNP PARIBAS LARGE CAP Fund - Direct Plan - Growth Option
150206,INF251K01HR8,,BARODA BNP PARIBAS Conservative Hybrid Fund - Direct Plan - Growth Option
150212,INF251K01HQ0,,BARODA BNP PARIBAS Mid Cap Fund - Direct Plan - Growth Option
150237,INF251K01GP4,,BARODA BNP PARIBAS Corporate Bond Fund - Direct Plan - Growth Option
150251,INF251K01OT0,,BARODA BNP PARIBAS ARBITRAGE FUND-DIRECT PLAN-GROWTH OPTION
150260,INF251K01OZ7,,Baroda BNP Paribas Aggressive Hybrid Fund- DIRECT PLAN - GROWTH OPTION
150264,INF251K01PN0,,BARODA BNP PARIBAS Focused Fund - Direct Plan - Growth Option
150266,INF251K01PT7,,BARODA BNP PARIBAS India Consumption Fund - Direct Plan - Growth Option
150285,INF251K01QT5,,Baroda BNP Paribas Aqua Fund of Fund - Direct Plan - Growth Option
150310,INF109KC10C2,,ICICI PRUDENTIAL HOUSING OPPORTUNITIES FUND - Direct Plan Growth
150313,INF789F1AVH8,,UTI Nifty Midcap 150 Quality 50 Index Fund - Direct Plan - Growth Option
150316,INF209KB14H3,,Aditya Birla Sun Life Fixed Term Plan - Series TQ (1879 days) - Direct Plan - Growth Option
150320,INF174KA1IW9,,Kotak FMP Series-294-105 days-Direct Plan- Growth
150326,INF277KA1372,,Tata Nifty SDL Plus AAA PSU Bond Dec 6040 Index Fund- Direct Plan-Growth
150344,INF277KA1430,,Tata Nifty India Digital ETF Fund of Fund-Direct Plan-Growth
150346,INF03VN01530,,WhiteOak Capital Flexi Cap Fund Direct Plan-Growth
150353,INF209KB19H2,,Aditya Birla Sun Life Crisil IBX 60:40 SDL+AAA PSU-Apr 2027 Index Fund-Direct Growth
150358,INF769K01IH8,,Mirae Asset Nifty SDL Jun 2027 Index Fund -Direct Plan - Growth
150367,INF0J8L01065,,NJ Arbitrage Fund - Direct Plan - Growth Option
150369,INF0J8L01081,,NJ Overnight Fund - Direct Plan - Growth Option
150376,INF754K01OP1,,Edelweiss Focused Fund - Direct Plan - Growth
150379,INF200KA11M0,,SBI Fixed Maturity Plan (FMP) - Series 66 (1361 Days) - Direct Plan - Growth
150387,INF251K01QZ2,,Baroda BNP Paribas Flexi Cap Fund - Direct Plan - Growth Option
150390,INF082J01416,,Quantum Nifty 50 ETF Fund of Fund - Direct Plan - Growth
150392,INF767K01RE0,,LIC MF Money Market Fund-Direct Plan-Growth
150395,INF179KC1CU9,,HDFC FMP 1158D July 2022 - Growth Option - Direct Plan
150404,INF194KB1DJ2,,BANDHAN MIDCAP FUND - GROWTH - DIRECT PLAN
150407,INF582M01HW2,,Union Gilt Fund - Direct Plan - Growth Option
150410,INF789F1AVR7,,UTI Gilt Fund with 10 year Constant Duration - Direct Plan - Growth Option
150428,INF740KA1RB9,,DSP Nifty Midcap 150 Quality 50 Index Fund - Direct - Growth
150440,INF966L01AT0,,quant Large Cap Fund - Growth Option - Direct Plan
150443,INF247L01BC9,,Motilal Oswal BSE Financials ex Bank 30 Index Fund Direct Growth
150449,INF109KC17D5,,ICICI Prudential Fixed Maturity Plan - Series 88 - 226 Days Plan E - Direct Plan - Growth
150452,INF109KC11D8,,ICICI Prudential Nifty 200 Momentum 30 Index Fund - Direct Plan - Growth
150460,INF200KA15M1,,SBI Fixed Maturity Plan (FMP) - Series 67 (1467 Days) - Direct Plan - Growth
150468,INF109KC13E2,,ICICI Prudential Nifty IT Index Fund - Direct Plan - Growth
150470,INF769K01IN6,,Mirae Asset Balanced Advantage Fund Direct Plan- Growth
150481,INF090I01WQ5,,Franklin India Balanced Advantage Fund- Growth- Direct
150484,INF209KB17J2,,Aditya Birla Sun Life Long Duration Fund-Direct Growth
150487,INF204KC1584,,Nippon India Nifty Alpha Low Volatility 30 Index Fund - Direct Plan - Growth Option
150505,INF760K01KC4,,Canara Robeco Banking and PSU Debt Fund- Direct Plan- Growth Option
150513,INF0GCD01503,,TRUSTMF MONEY MARKET FUND-DIRECT PLAN-GROWTH
150515,INF959L01GD6,,Navi Nifty India Manufacturing Index Fund- Direct Plan- Growth
150518,INF247L01BF2,,Motilal Oswal BSE Enhanced Value Index Fund-Direct plan
150521,INF247L01BI6,,Motilal Oswal BSE Quality Index Fund-Direct plan
150532,INF277KA1497,,Tata Housing Opportunities Fund - Direct Plan - Growth
150539,INF109KC12I5,,ICICI Prudential PSU Equity Fund - Direct Plan - Growth
150545,INF192K01MP8,,JM Short Duration Fund (Direct) - Growth
150547,INF179KC1DC5,,HDFC FMP 1406D August 2022 - Growth Option - Direct Plan
150554,INF582M01IK5,,Union Retirement Fund - Direct Plan - Growth Option
150562,INF680P01323,,Shriram Overnight Fund -  Direct Growth
150571,INF903JA1LE2,,Sundaram Flexicap Fund Direct Growth
150581,INF754K01OX5,,Edelweiss Gold and Silver ETF FOF - Direct Plan - Growth
150584,INF03VN01597,,WhiteOak Capital Mid Cap Fund Direct Plan Growth
150587,INF03VN01621,,WhiteOak Capital ELSS Tax Saver Fund Direct Plan Growth
150591,INF194KB1DP9,,BANDHAN NIFTY200 MOMENTUM 30 INDEX FUND - GROWTH - DIRECT PLAN
150595,INF769K01IQ9,,Mirae Asset Global Electric & Autonomous Vehicles Equity Passive FOF - Direct Plan - Growth
150597,INF769K01IS5,,Mirae Asset Global X Artificial Intelligence & Technology ETF Fund of Fund - Direct Plan- Growth
150601,INF174KA1JI6,,Kotak FMP Series 296-Direct Plan-Growth
150602,INF200KA17N5,,SBI Fixed Maturity Plan (FMP) - Series 64 (1169 Days) - Direct Plan - Growth
150615,INF846K015J4,,Axis Silver Fund of Fund- Direct Plan-Growth Option
150624,INF174KA1JN6,,Kotak Business Cycle - Direct Plan - Growth
150627,INF204KC1634,,Nippon India Fixed Maturity Plan-XLIV-Series 1-Direct Plan-Growth Option
150631,INF0K1H01040,,Samco Overnight Fund - Direct Plan - Growth Option
150636,INF194KB1DV7,,BANDHAN NIFTY100 LOW VOLATILITY 30 INDEX FUND - GROWTH - DIRECT PLAN
150639,INF109KC10J7,,ICICI Prudential Nifty50 Equal Weight Index Fund- Direct Plan - Growth
150642,INF247L01BM8,,Motilal Oswal Gold and Silver Passive Fund of Funds(Direct Plan)
150643,INF109KC16J4,,ICICI Prudential Nifty Auto Index Fund - Direct Plan - Growth
150649,INF200KA15O7,,SBI Fixed Maturity Plan (FMP) - Series 68 (1302 Days) - Direct Plan - Growth
150655,,,HDFC FMP 1359D September - Growth Option - Direct Plan
150659,INF767K01RK7,,LIC MF Multi Cap Fund-Direct Plan-Growth
150663,INF209KB10M1,,Aditya Birla Sun Life Nifty SDL Sep 2025 Index Fund-Direct Growth
150671,INF754K01PF9,,Edelweiss CRISIL IBX 50:50 Gilt Plus SDL April 2037 Index Fund - Direct Plan - Growth
150673,INF200KA10P5,,SBI Nifty Midcap 150 Index Fund - Direct Plan - Growth
150677,INF200KA16P2,,SBI Nifty Smallcap 250 Index Fund - Direct Plan - Growth
150681,INF200KA12Q9,,SBI |CRISIL IBX Gilt Index - June 2036 Fund - Direct Plan - Growth
150685,INF109KC12K1,,ICICI PRUDENTIAL TRANSPORTATION AND LOGISTICS FUND - Direct Plan - Growth
150688,INF209KB15M0,,Aditya Birla Sun Life Multi-Asset Passive FOF-Direct Growth
150692,INF277KA1554,,TATA CRISIL-IBX GILT INDEX - APRIL 2026 INDEX FUND - DIRECT PLAN - GROWTH
150698,INF209KB10N9,,Aditya Birla Sun Life Crisil IBX Gilt-April 2026 Index Fund-Direct Growth
150702,INF209KB14N1,,Aditya Birla Sun Life Crisil IBX 50:50 Gilt Plus SDL Apr 2028 Index Fund-Direct Growth
150706,INF200KA18Q6,,SBI CRISIL IBX Gilt Index - April 2029 Fund - Direct Plan - Growth
150711,INF200KA14R3,,SBI CRISIL IBX SDL Index - September 2027 Fund - Direct Plan - Growth
150714,INF789F1AWB9,,UTI Gold ETF Fund of Fund - Direct Plan - Growth Option
150716,INF194KB1EB7,,BANDHAN TRANSPORTATION AND LOGISTICS FUND - GROWTH - DIRECT PLAN
150725,INF174KA1JT3,,Kotak Nifty SDL Plus AAA PSU Bond Jul 2028 60:40 Index Fund Direct Plan - Growth
150727,INF754K01PN3,,Edelweiss CRISIL IBX 50:50 Gilt Plus SDL June 2027 Index Fund - Direct Plan - Growth
150729,INF109KC14L5,,ICICI Prudential Nifty SDL Dec 2028 Index Fund - Direct Plan - Growth
150733,INF109KC18K8,,ICICI Prudential Nifty G-Sec Dec 2030 Index Fund - Direct Plan - Growth
150737,INF179KC1DU7,,HDFC Silver ETF Fund of Fund - Growth Option - Direct Plan
150738,INF277KA1612,,Tata Nifty Midcap 150 Momentum 50 Index Fund - Growth - Direct Plan
150746,INF194KB1EH4,,BANDHAN CRISIL IBX GILT APRIL 2026 INDEX FUND - DIRECT PLAN - GROWTH
150751,INF846K012K9,,Axis NASDAQ 100 US Specific Equity Passive FOF - Direct Plan - Growth
150754,INF204KC1683,,Nippon India Nifty AAA PSU Bond Plus SDL - Sep 2026 Maturity 50:50 Index Fund-Direct Plan-Growth Option
150778,INF209KB12O3,,Aditya Birla Sun Life Crisil IBX Gilt-Apr-2029 Index Fund-Direct Growth
150783,INF174KA1KE3,,Kotak FMP Series 297-Direct Plan-Growth
150788,INF769K01JD5,,Mirae Asset Nifty AAA PSU Bond Plus SDL Apr 2026 50:50 Index Fund - Direct Plan - Growth
